objectID,Title,ArtistName,TimePeriod,Region Detailed,Country,Century,Culture
35968,Forts Zeelandia and Provintia and the City of Tainan,Unidentified artist,19th century,China,China,1900's,Asian Art
35970,Song of the Lute,Ding Yunpeng,1585,China,China,1500's,Asian Art
35971,Landscape after Li Cheng,Unidentified artist,"18th century or later, spurious date of 1680",China,China,1800's,Asian Art
36005,"Mountain Market, Clearing Mist",Xia Gui,early 13th century,China,China,1300's,Asian Art
36011,First half of Ten Thousand Li of the Yangzi River,Unidentified artist,late 15th century,China,China,1500's,Asian Art
36013,Lady in a Bamboo Grove,Qiu Ying,Unavailable,China,China,Unavailable,Asian Art
36018,(Copy after) The Sixteen Luohans,Shitao (Zhu Ruoji),19th–early 20th century,China,China,1900's,Asian Art
36020,Pomegranates after Ma Lin,Unidentified artist,Unavailable,China,China,Unavailable,Asian Art
36023,Fisherman and family,Zhang Lu,16th century,China,China,1600's,Asian Art
36026,Spring Ablutions at the Orchid Pavilion,Wang Wenzhi,Unavailable,China,China,Unavailable,Asian Art
36028,Children Playing,Unidentified,16th–17th century,China,China,1600's,Asian Art
36029,Water-moon Avalokiteshvara,Unidentified artist,first half of the 14th century,Korea,Korea,1400's,Asian Art
36030,Lady in a Bamboo Grove after Qiu Ying,Shen Shuo,Unavailable,China,China,Unavailable,Asian Art
36035,Rosy Sunset,Wen Tong,16th century,China,China,1600's,Asian Art
36036,Hibiscus and Egret,Jiang Tingxi,dated 1724,China,China,1700's,Asian Art
36037,Viewing the Moon under a Pine Tree,Ma Yuan,early 13th century,China,China,1300's,Asian Art
36039,Horse and Willow Tree,Unidentified artist,early 15th century,China,China,1500's,Asian Art
36040,Four Deities with Horses,Unidentified,Unavailable,Japan,Japan,Unavailable,Asian Art
36042,Dragon and Landscape,Unidentified artist,14th century; plus later addition,China,China,1400's,Asian Art
36043,Bird,Ogawa Haritsu (Ritsuō),18th century,Japan,Japan,1800's,Asian Art
36047,Miniature landscapes,Zhang Zongcang,datable to 1751–54,China,China,1700's,Asian Art
36054,Landscape with Birds,Unidentified artist,16th century?,China,China,1600's,Asian Art
36055,Landscape with great pine,Ma Lin,second quarter of the 13th century,China,China,1300's,Asian Art
36058,Prunus,Zhou Zonglian,dated 1532 or 1592,China,China,1500's,Asian Art
36059,Flowers and Butterflies,Ma Quan,Unavailable,China,China,Unavailable,Asian Art
36063,Wild Geese in Winter,Unidentified artist,13th century,China,China,1300's,Asian Art
36065,Man Sleeping on a Bamboo Couch,Unidentified artist,Unavailable,China,China,Unavailable,Asian Art
36066,Portraits of Emperors of Successive Dynasties,Unidentified artist,early 20th century (?),China,China,2000's,Asian Art
36067,"Spring Landscape with Plum Blossoms, Scholar and Deer",Xie Shichen,dated 1548,China,China,1500's,Asian Art
36081,Portrait of the Artist's Great-Granduncle Yizhai at the Age of Eighty-Five,Ruan Zude,"dated ""xinyou"" (1561 or 1621?)",China,China,1500's,Asian Art
36082,Portrait of an Old Lady,Ruan Zude,"dated ""xinyou"" (1561 or 1621?)",China,China,1500's,Asian Art
36083,The Sixteen Luohans,Chen Xian,spurious date of 1634,China or Japan,Japan,1600's,Asian Art
36084,Flowering Plum in Moonlight and Snow,Liu Shiru,16th century,China,China,1600's,Asian Art
36089,"Autumn Landscape, leaf from Album for Zhou Lianggong",Xiang Shengmo,1654,China,China,1600's,Asian Art
36090,"White Crane Mountain, leaf from Album for Zhou Lianggong",Ye Xin,datable to 1654–55,China,China,1600's,Asian Art
36091,"Mountain Retreat,  leaf from Album for Zhou Lianggong",Shi Lin,datable to 1654–55,China,China,1600's,Asian Art
36093,Landscape for Zhao Yipeng,Tang Yin,late 15th–early 16th century,China,China,1500's,Asian Art
36103,Eight Songs of the Xiao and Xiang Rivers,Wen Zhengming,Unavailable,China,China,Unavailable,Asian Art
36105,"Cranes, Peach Tree, and Chinese Roses",Shen Quan,early 18th century,China,China,1800's,Asian Art
36106,Flowers and Birds,Shen Quan,1750,China,China,1700's,Asian Art
36107,Ema (Votive Painting) of Chinese Lion Led by Utenō,Unavailable,dated 1627,Japan,Japan,1600's,Asian Art
36109,Ema (Votive Painting) of Chinese Lion and Peony Tree,Unavailable,1649,Japan,Japan,1600's,Asian Art
36112,Ōtsu-e of Thirteen Buddhist Deities,Unavailable,17th century,Japan,Japan,1700's,Asian Art
36120,Washing the White Elephant,Chen Zi,Unavailable,China,China,Unavailable,Asian Art
36129,Landscapes Painted for Wang Kui,Wang Jian,1674–76,China,China,1600's,Asian Art
36131,Landscapes with poems,Gong Xian,1688,China,China,1600's,Asian Art
36133,View From a Mountain Pavilion,Li Yin,1700,China,China,1700's,Asian Art
36136,Spring Breeze of Myriad Pasts,Zhang You,Unavailable,China,China,Unavailable,Asian Art
36137,Gibbons and Deer,Unidentified artist,Unavailable,China,China,Unavailable,Asian Art
36138,Listening to the Zither Among Streams and Pines,Xie Shichen,Unavailable,China,China,Unavailable,Asian Art
36146,Copy of a Portrait of Zhao Mengfu,Unidentified artist,19th century,China,China,1900's,Asian Art
36160,Bringing the Message of Victory to Dongshan,Wang Su,1862,China,China,1800's,Asian Art
36168,Landscapes after old masters,Du Xiang,19th century,China,China,1900's,Asian Art
36170,"Animals, Flowers and Birds",Ren Yi (Ren Bonian),19th century,China,China,1900's,Asian Art
36171,Landscapes,Zhang Zhiwan,dated 1875,China,China,1800's,Asian Art
36184,Insects and Flowers,Ju Lian,Unavailable,China,China,Unavailable,Asian Art
36430,Tiger,Unidentified,14th century,China,China,1400's,Asian Art
36431,Dragon,Unidentified,14th century,China,China,1400's,Asian Art
36432,Plum Blossoms,Jin Nong,dated 1757,China,China,1700's,Asian Art
36433,Portrait of Ren'an in a Landscape,Shitao (Zhu Ruoji),dated 1684,China,China,1600's,Asian Art
36457,Grapevine in the Wind,Unidentified artist,16th century,Korea,Korea,1600's,Asian Art
36459,Peacock and Hollyhocks,Bian Lu,mid-14th century,China,China,1400's,Asian Art
37393,Zhong Kui,Ren Yi (Ren Bonian),dated 1883,China,China,1800's,Asian Art
37394,Boating beneath Echo Hill,Mei Qing,datable to 1673,China,China,1600's,Asian Art
37395,Miscellaneous Studies,Chen Hongshou,one leaf dated 1619,China,China,1600's,Asian Art
37396,"Figures, flowers, and landscapes",Chen Hongshou,one leaf dated 1627,China,China,1600's,Asian Art
37793,Pair of Hindu Manuscript Covers,Unavailable,12th century,Nepal (Kathmandu Valley),Nepal,1200's,Asian Art
37800,Sadaksari-Lokeshvara Surrounded by Manifestations and Monks,Unavailable,late 15th century,China,China,1500's,Asian Art
37801,Portrait of Jnanatapa Attended by Lamas and Mahasiddhas,Unavailable,ca. 1350,"Eastern Tibet, Kham, Riwoche monastery",China,1300's,Asian Art
37803,Mandala of Hevajra,Sakya School,16th century,China,China,1600's,Asian Art
37811,Demons Fighting Over an Animal Limb,Unavailable,late 17th century,"India (Rajasthan, Bikaner or the Deccan)",India,1700's,Asian Art
37819,"Buddhist Attendant, Possibly a Dakini",Unavailable,late 18th century,Eastern Tibet,China,1800's,Asian Art
37855,Krishna's Parents Search for Him,Unavailable,ca. 1615,India,India,1600's,Asian Art
37869,A Lady Applying Henna to Her Foot,"Ustad Mohamed, son of Murad",ca. 1720–30,"India (Rajasthan, Bikaner)",India,1700's,Asian Art
37873,Lady Musician Playing a Sitar,Unavailable,ca. 1800,"India (Rajasthan, Kota)",India,1800's,Asian Art
37876,Portrait of Thakur Utham Ram,Unavailable,ca. 1760,"India (Rajasthan, Jhilai)",India,1700's,Asian Art
37877,Head of Krishna: cartoon for a mural of the Raslila,Sahib Ram,ca. 1800,"India (Rajasthan, Jaipur)",India,1800's,Asian Art
37878,Preparatory Study for a Portrait of Man Singh and His Harem,Unavailable,1810–15,"India (Rajasthan, Jodhpur)",India,1800's,Asian Art
37880,An Encampment of Yogis,Unavailable,ca. 1660,"India (Deccan, Aurangabad?)",India,1600's,Asian Art
37898,A King Seated on His Throne,Unavailable,1725,India (Gujarat),India,1700's,Asian Art
37913,Bishen Singh as a Young Man,Unavailable,ca. 1780,"India (Rajasthan, Uniara)",India,1700's,Asian Art
37914,Maharana Sangram Singh Hunting Wild Boar,Unavailable,ca. 1725,"Western India, Rajasthan, Udaipur",India,1700's,Asian Art
37915,Maharana Amar Singh II or Sangram Singh Hunting Wild Boar,Unavailable,19th century,"Western India, Rajasthan, Udaipur",India,1900's,Asian Art
37916,Maharana Jagat Singh II in Procession,Unavailable,ca. 1745,"India (Rajasthan, Mewar)",India,1700's,Asian Art
37922,Horoscope with Floral Drawings,Unavailable,1850,"India (Madhya Pradesh, Gwalior or Indore)",India,1800's,Asian Art
37924,Double Sided Painting; Male with Flower/ Soldier,Unavailable,mid-late 19th century,India,India,1900's,Asian Art
37926,Priests before Shri Nathji,Unavailable,ca. 1820,"India (Rajasthan, Kota)",India,1800's,Asian Art
37928,Seated Four-Armed Ganesha,Unavailable,ca. 1775,"India (Rajasthan, Bundi)",India,1700's,Asian Art
37945,Lady on a Terrace,Unavailable,18th century,"India (Punjab Hills, Chamba)",India,1800's,Asian Art
37959,Radha and Krishna on a Bed at Night,Unavailable,ca. 1830,"India (Punjab Hills, Sirmur)",India,1800's,Asian Art
37960,Hanuman Bearing the Mountaintop with Medicinal Herbs,Unavailable,ca. 1800,India (Rajasthan),India,1800's,Asian Art
37968,Krishna and the Gopis Take Shelter from the Rain,Unavailable,1760,"India (Rajasthan, Jaipur)",India,1700's,Asian Art
37970,"Portrait of a Lama, Possibly Dromton",Unavailable,last quarter of the 11th century,China,China,1100's,Asian Art
37971,Lineage Portrait of an Abbot,Unavailable,ca. 1350,Central Tibet,China,1300's,Asian Art
37974,Maharaja Fateh Singh Hunting Female Bears,Pannalai,dated 1917,"Western India, Rajasthan, Udaipur",India,1900's,Asian Art
37987,A Lady Gazing at Doves,Unavailable,ca. 1780–1800,"India (Punjab Hills, Mandi)",India,1700's,Asian Art
37989,The Churning of the Ocean of Milk,Unavailable,ca. 1780–90,"India (Punjab Hill, Mandi)",India,1700's,Asian Art
37990,Krishna Spying on Radha,Unavailable,ca. 1780–90,"India (Punjab Hills, Mandi)",India,1700's,Asian Art
37991,The Timid Bride,Unavailable,ca. 1800,"India (Punjab Hills, Kangra)",India,1800's,Asian Art
37992,"Abhisarika Nayika, a Heroine Longing for Her Lover",Unavailable,ca. 1790–1800,"India (Punjab Hills, Kangra)",India,1700's,Asian Art
37993,Lady Holding a Sparkler,Unavailable,ca. 1800,"India (Punjab Hills, Kangra)",India,1800's,Asian Art
38009,Raja Balwant Singh’s Vision of Krishna and Radha,Nainsukh,ca. 1745–50,"India, Punjab Hills, kingdom of Jasrota",India,1700's,Asian Art
38012,Melancholy Courtesan,Unavailable,ca. 1750,"India (Rajasthan, Bundi, or Kota [?])",India,1700's,Asian Art
38013,"The Wrathful Bon Deity Walse Ngampa, One of the Five Fortress Meditational Deities",Unavailable,early 15th century,China,China,1500's,Asian Art
38016,Maharaja Sidh Sen Receiving an Embassy,A Master of the Mandi atelier,ca. 1700–10,"India (Himachal Pradesh, Mandi)",India,1700's,Asian Art
38020,Illustration from a Ragamala Series (Garland of Musical Modes),Unavailable,late 18th century,India (Punjab Hills),India,1800's,Asian Art
38022,Krishna with an Ascetic,Unavailable,ca.1850,"India (Maharashtra, Marathi)",India,1800's,Asian Art
38023,Folk Painting,Unavailable,1725,"India (Rajasthan, Marwar)",India,1700's,Asian Art
38031,Prince with Four Attendants,Sri Prathi Singh of Ratlam,late 18th–early 19th century,India (Rajasthan),India,1800's,Asian Art
38032,The Three Roads,Unavailable,ca. 1840,India (Hyderabad),India,1800's,Asian Art
38035,A Holy Man Seated on a Terrace,Unavailable,ca. 1850,"India (Punjab Hills, Kangra)",India,1800's,Asian Art
38038,A Lady Playing the Tanpura,Unavailable,ca. 1735,"India (Rajasthan, Kishangarh)",India,1700's,Asian Art
38039,"Mahadevi, the Great Goddess",Unavailable,ca. 1725,"India (Rajasthan, Bikaner)",India,1700's,Asian Art
38040,Maharana Jagat Singh Hawks for Cranes,Shiva and Dayal,dated 1744,"Western India, Rajasthan, Udaipur",India,1700's,Asian Art
38041,A Prince Hunting Boars with His Retinue,Unavailable,late 18th–early 19th century,"Western India, Rajasthan, Jhilai",India,1800's,Asian Art
38042,Maharana Bhim Singh and Retinue Embark on a Hunt,Chokha,ca. 1805–10,"Western India, Rajasthan, Udaipur or Devgarh",India,1800's,Asian Art
38043,Fortified City of Ranthambhor,Bagta,ca. 1810–18,"India (Jaipur, Rajasthan)",India,1800's,Asian Art
38044,Maharaja Sardar Singh of Bikaner,Chotu,ca. 1860–70,"India (Rajasthan, Bikaner)",India,1800's,Asian Art
38045,Maharana Sangram Singh II Hunts Hares at Naramangra,Unidentified artist,ca. 1720–30,"Western India, Rajasthan, Udaipur",India,1700's,Asian Art
38046,Prince Padam Singh of Bikaner with His Bard Gordhar on a Terrace at Night,Bhavani Das,ca. 1725,"India, Rajasthan, Kishangarh",India,1700's,Asian Art
38048,Shah Jahan Hunting Blackbuck with Trained Cheetahs,Unavailable,1710–15,"Western India, Rajasthan, Udaipur",India,1700's,Asian Art
38052,Buddha Within a Stupa,Unavailable,16th–17th century,China,China,1600's,Asian Art
38057,Sketch with Kali and a Young Boy,Unavailable,ca. 1800,"India (Punjab Hills, Kangra?)",India,1800's,Asian Art
38058,"Maharana Amar Singh II, Prince Sangram Singh and Courtiers Watch a Performance",Unavailable,ca. 1705–8,"India (Rajasthan, Mewar)",India,1700's,Asian Art
38070,The Buddha Descending from Trayastrimsa Heaven at Sankissa,Unavailable,19th century,Thailand,Thailand,1900's,Asian Art
38072,Lamaist Mandala,Unavailable,17th century,China,China,1700's,Asian Art
38347,Lha Mo Riding on a Donkey,Unavailable,18th century,China,China,1800's,Asian Art
38822,Luohans,Unidentified,17th–18th century,China,China,1700's,Asian Art
39482,Mandala of Wakamiya of Kasuga Shrine (Kasuga wakamiya mandara),Unavailable,early 14th century,Japan,Japan,1400's,Asian Art
39483,Weighing Books,Guo Xu,early 16th century,China,China,1600's,Asian Art
39536,Living Aloft: Master Liu's Retreat,Wen Zhengming,1543,China,China,1500's,Asian Art
39540,Two eagles,Bada Shanren (Zhu Da),dated 1702,China,China,1700's,Asian Art
39542,Riverbank,Dong Yuan,Unavailable,China,China,Unavailable,Asian Art
39543,Palace banquet,Unidentified artist,Unavailable,China,China,Unavailable,Asian Art
39546,Bamboo after Wen Tong,Ke Jiusi,dated 1343,China,China,1300's,Asian Art
39547,"Bamboo, old tree, and rock",Wu Zhen,dated 1338,China,China,1300's,Asian Art
39548,Rocky Landscape with Pines,Zhang Xun,before 1346,China,China,1300's,Asian Art
39549,Traveling through Snow-Covered Mountains,Yao Yanqing (Tingmei),Unavailable,China,China,Unavailable,Asian Art
39550,The Simple Retreat,Wang Meng,ca. 1370,China,China,1300's,Asian Art
39551,Mandarin ducks and cotton rose hibiscus,Lü Ji,late 15th century,China,China,1500's,Asian Art
39552,Remonstrating with the emperor,Liu Jun,late 15th–early 16th century,China,China,1500's,Asian Art
39553,Drunken recluse beneath an old tree,Chen Zihe,early 16th century,China,China,1600's,Asian Art
39556,Joint Landscape,Shen Zhou,ca. 1509 and 1546,China,China,1500's,Asian Art
39641,Ink Making,Unidentified artist,early 19th century,China,China,1900's,Asian Art
39651,Equestrian Portrait of a Noble,Bakhta,ca. 1775,"India (Rajasthan, Devgarh)",India,1700's,Asian Art
39654,Garden of the Inept Administrator,Wen Zhengming,1551,China,China,1500's,Asian Art
39667,The Scholar Fu Sheng Transmitting the Book of Documents,Du Jin,15th–mid-16th century,China,China,1500's,Asian Art
39668,"Old Trees, Level Distance",Guo Xi,ca. 1080,China,China,1000's,Asian Art
39669,Taima Mandala,Unavailable,14th century,Japan,Japan,1400's,Asian Art
39714,View of a Garden Villa,Yuan Jiang,18th century (?),China,China,1800's,Asian Art
39725,Three Girls on a Riverbank,Torii Kiyonaga,early 19th century,Japan,Japan,1900's,Asian Art
39764,Ink Play,Jin Nong,dated 1754,China,China,1700's,Asian Art
39767,Grooms and Foreign Horses,Jin Nong,17th–18th century,China,China,1700's,Asian Art
39810,Bird peddler,Unidentified artist,late 15th–early 16th century,China,China,1500's,Asian Art
39881,Amitabha and Kshitigarba,Unidentified artist,first half of the 14th century,Korea,Korea,1400's,Asian Art
39882,Amitabha triad,Unidentified artist,ca. 13th century,Korea,Korea,1300's,Asian Art
39883,Kshitigarbha,Unidentified artist,first half of the 14th century,Korea,Korea,1400's,Asian Art
39887,Brahma with Attendants and Musicians,Unidentified artist,late 16th century,Korea,Korea,1600's,Asian Art
39889,Portrait of the Great Master Seosan,Unidentified artist,late 17th–18th century,Korea,Korea,1700's,Asian Art
39894,Maharana Amar Singh II with Ladies of the Zenana outside the Picture Hall at Rajnagar,Stipple Master,ca. 1707–8,"India (Udaipur, Rajasthan)",India,1700's,Asian Art
39901,Night-Shining White,Han Gan,ca. 750,China,China,Before 1000,Asian Art
39933,"Sketch of an ""Inviting Rain"" Mandala",Unavailable,12th century,Japan,Japan,1200's,Asian Art
39935,Palace Ladies Bathing Children,Unidentified artist,11th century,China,China,1100's,Asian Art
39936,Finches and bamboo,Emperor Huizong,early 12th century,China,China,1200's,Asian Art
39937,Fish at play,Zhao Kexiong,12th–late 13th century,China,China,1200's,Asian Art
39993,Crane in a bamboo grove,Unidentified artist,14th–early 15th century,China,China,1400's,Asian Art
40002,Landscape in the style of Fan Kuan,Unidentified artist,early 12th century,China,China,1200's,Asian Art
40003,Travelers in a Wintry Forest,Unidentified artist,early 12th century,China,China,1200's,Asian Art
40010,Monkey and Bee,Okamoto Toyohiko,19th century,Japan,Japan,1900's,Asian Art
40021,Snow Clearing: Landscape after Li Cheng,Wang Hui,dated 1669,China,China,1600's,Asian Art
40053,Xiantang Estuary,Xia Gui,ca. 1200,China,China,1200's,Asian Art
40055,Emperor Xuanzong's Flight to Shu,Unidentified artist,mid-12th century,China,China,1200's,Asian Art
40057,Fisherman's Lodge At Mount Xisai,Li Jie,ca. 1170,China,China,1100's,Asian Art
40072,Beauty Writing a Letter (copy of a section of the Hikone Screen),Unavailable,17th–18th century,Japan,Japan,1700's,Asian Art
40080,Fragrant Snow at Broken Bridge,Wang Mian,14th century,China,China,1400's,Asian Art
40081,Wang Xizhi watching geese,Qian Xuan,ca. 1295,China,China,1200's,Asian Art
40086,Scholar viewing a waterfall,Ma Yuan,late 12th–early 13th century,China,China,1200's,Asian Art
40106,Buddhist Temples amid Autumn Mountains,Unidentified artist,14th century,China,China,1400's,Asian Art
40133,Orchids,Ma Lin,second quarter of the 13th century,China,China,1300's,Asian Art
40137,Mandala of the Bodhisattva Monju (Manjushri) of the Eight Syllables,Unavailable,13th century,Japan,Japan,1300's,Asian Art
40278,Meeting between Yaoshan and Li Ao,Zhiweng,before 1256,China,China,1200's,Asian Art
40282,Buddha Amitabha descending from his Pure Land,Unidentified artist,13th century,China,China,1300's,Asian Art
40284,Narcissus,Zhao Mengjian,mid-13th century,China,China,1300's,Asian Art
40303,Six Horses,Unidentified artists,13th–14th century,China,China,1300's,Asian Art
40336,Shiraito Waterfall at Hakone,Utagawa Hiroshige,19th century,Japan,Japan,1900's,Asian Art
40337,Koyurugi Beach of Sagami Province,Utagawa Hiroshige,19th century,Japan,Japan,1900's,Asian Art
40338,Kannon Slope of the Kiso Highway,Utagawa Hiroshige,19th century,Japan,Japan,1900's,Asian Art
40339,Shibaura Bay of Musashi Province,Utagawa Hiroshige,19th century,Japan,Japan,1900's,Asian Art
40340,Mt. Nokogiri Seen from a Distance,Utagawa Hiroshige,19th century,Japan,Japan,1900's,Asian Art
40341,Honmoku Bay of Musashi Province,Utagawa Hiroshige,19th century,Japan,Japan,1900's,Asian Art
40351,Bellflowers in Basket,Ogata Kenzan,18th century,Japan,Japan,1800's,Asian Art
40352,Three Beauties Playing Musical Instruments,Utagawa Kuniyoshi,19th century,Japan,Japan,1900's,Asian Art
40353,Mynah Birds Attacking an Owl,Sesson Shūkei,probably 19th century,Japan,Japan,1900's,Asian Art
40354,Camellia by Water,Ogata Kenzan,dated 1741,Japan,Japan,1700's,Asian Art
40393,The Pleasures of Fishes,Zhou Dongqing,dated 1291,China,China,1200's,Asian Art
40418,Landscape with Palace,Unavailable,Unavailable,China,China,Unavailable,Asian Art
40420,Lȕ Dongbin and the Spirit of the Peony,Unidentified artist,Unavailable,China,China,Unavailable,Asian Art
40427,Birds Pursued by an Eagle,Unavailable,late 17th century,Japan,Japan,1700's,Asian Art
40428,Examining the Hanging Picture,Unidentified artist,ca. 1650,Korea,Korea,1600's,Asian Art
40429,Pavilion by the Lake,Samoje,late 18th century,Korea,Korea,1800's,Asian Art
40430,The Wise Men and Scrolls,Unidentified artist,19th century,Korea,Korea,1900's,Asian Art
40431,Wise Men and Children,Unidentified artist,19th century,Korea,Korea,1900's,Asian Art
40432,Scholar in a Lakeside Pavilion,Samoje,late 18th century,Korea,Korea,1800's,Asian Art
40434,Scholars Strolling by the Waterfall,Unidentified artist,ca. 1650,Korea,Korea,1600's,Asian Art
40436,Examining Antiques at Literati Gathering,Wang Li Mu,18th century,Korea,Korea,1800's,Asian Art
40439,Shakyamuni coming down from the mountains,Unidentified artist,late 13th–early 14th century,China,China,1300's,Asian Art
40445,Plum Branch,Yi Yu-won,dated 1888,Korea,Korea,1800's,Asian Art
40448,Buddha Amitabha Descending from His Pure Land,Unavailable,late 13th century,China,China,1300's,Asian Art
40449,Buddha with Two Attendants,Unidentified artist,16th–17th century,probably Japan,Japan,1600's,Asian Art
40451,Rainy Landscape with Travelers,Unidentified artist,15th century,Korea,Korea,1500's,Asian Art
40452,Guanyin Seated on a Lotus Throne,Unavailable,15th century,Korea,Korea,1500's,Asian Art
40456,Bamboo and rocks,Li Kan,dated 1318,China,China,1300's,Asian Art
40462,Bean Vine,Itō Jakuchū,mid-18th century,Japan,Japan,1800's,Asian Art
40507,Grooms and Horses,Zhao Mengfu,dated 1296 and 1359,China,China,1200's,Asian Art
40511,Nine Songs,Zhao Mengfu,14th century (?),China,China,1400's,Asian Art
40516,Reading a Sutra by Moonlight,Unidentified artist,ca. 1332,China,China,1300's,Asian Art
40987,Snowy landscape with rustic riverside retreat,Liu Songnian,ca. late 12th century,China,China,1200's,Asian Art
41154,Wind among the Trees on the Riverbank,Ni Zan,1363,China,China,1300's,Asian Art
41185,Spring Clouds at the Pine Studio,Zhang Yu,dated 1366,China,China,1300's,Asian Art
41193,Crows in Old Trees,Luo Zhichuan,early 14th century,China,China,1400's,Asian Art
41194,Landscape after a poem by Wang Wei,Tang Di,dated 1323,China,China,1300's,Asian Art
41195,Returning Fishermen,Tang Di,dated 1342,China,China,1300's,Asian Art
41468,Fisherman,Wu Zhen,ca. 1350,China,China,1300's,Asian Art
41471,Autumn Landscape with Herons and Ducks,Lü Ji,Unavailable,China,China,Unavailable,Asian Art
41472,Guanyin as the Nine-Lotus Bodhisattva,Unidentified artist,1593,China,China,1500's,Asian Art
41474,Marshal Wang,Unidentified artist,dated 1542,China,China,1500's,Asian Art
41475,Guanyin the Bringer of Sons,Unidentified artist,late 16th century,China,China,1600's,Asian Art
41476,The Yellow Pavilion,Xia Yong,ca.  1350,China,China,1300's,Asian Art
41478,Elegant Gathering in the Apricot Garden,Xie Huan,ca. 1437,China,China,1400's,Asian Art
41480,Landscapes and Poems,Dong Qichang,"17th century, probably after 1625",China,China,1700's,Asian Art
41483,Landscapes and trees,Gong Xian,ca. 1679,China,China,1600's,Asian Art
41484,"Lofty Scholar among Streams and Mountains, in the manner of Juran",Wang Jian,late 17th century,China,China,1700's,Asian Art
41485,Travelers among Streams and Mountains,Wu Li,probably 1670s,China,China,1600's,Asian Art
41487,Landscape in the Styles of Huang Gongwang and Gao Kegong,Wang Yuanqi,dated 1705,China,China,1700's,Asian Art
41488,The Strange Pines of Mount Tiantai,Dai Benxiao,1687,China,China,1600's,Asian Art
41491,Fish and rocks,Bada Shanren (Zhu Da),dated 1699,China,China,1600's,Asian Art
41492,"Hibiscus, Lotus, and Rock",Shitao (Zhu Ruoji),ca. 1705–7,China,China,1700's,Asian Art
42187,River Landscape,Chen Chun,Unavailable,China,China,Unavailable,Asian Art
42328,Spring Dawn Over the Elixir Terrace,Lu Guang,ca. 1369,China,China,1300's,Asian Art
42343,Zen Encounter (Niaoke Daolin and Bai Juyi),Kenkō Shōkei,16th century,Japan,Japan,1600's,Asian Art
42346,Landscape with Pavilion,Kenkō Shōkei 賢江祥啓,1478–80,Japan,Japan,1400's,Asian Art
42347,Eight Views of the Xiao and Xiang Rivers,Unavailable,16th century,Japan,Japan,1600's,Asian Art
42558,Portraits of members of a family,Unidentified artist,mid-19th century,China,China,1900's,Asian Art
42559,Miniature Album,Prince Yongxing,Unavailable,China,China,Unavailable,Asian Art
42616,Preliminary Drawing of Three Deer Mounted on a Hanging-scroll Painting of Flowering Bush Clover,Ogata Kōrin,early 18th century (drawing); early 19th century (painting),Japan,Japan,1800's,Asian Art
42634,Flowers and Goldfish,Sō Shizan,18th century,Japan,Japan,1800's,Asian Art
42889,Twenty-one Ancestors with Spirit Tablet,Unidentified artist,Unavailable,China,China,Unavailable,Asian Art
44100,Bodhisattva Guanyin Riding a White Lotus Petal,Unavailable,17th–18th century,China,China,1700's,Asian Art
44282,The Four Deities of Mount Kōya,Unavailable,late 14th century,Japan,Japan,1400's,Asian Art
44286,Rakan,Unavailable,Unavailable,Japan,Japan,Unavailable,Asian Art
44297,Sketch for a Painting of Mi Fu Inscribing a Poem on a Rock,Kano Tan'yū,dated 1666,Japan,Japan,1600's,Asian Art
44506,Ten Kings of Hell,Jin Chushi,before 1195,China,China,1100's,Asian Art
44527,Winter Landscapes and Flowers,Qian Weicheng,Unavailable,China,China,Unavailable,Asian Art
44569,Clouds and Spring Trees at Dusk,Gu Yun,dated 1888,China,China,1800's,Asian Art
44590,Bamboo in Wind,Xia Chang,ca. 1460,China,China,1400's,Asian Art
