objectID,Title,ArtistName,TimePeriod,Region Detailed,Country,Century,Culture
437326,Blind Orion Searching for the Rising Sun,Nicolas Poussin,1658,French,France,1600's,European Paintings
437327,The Companions of Rinaldo,Nicolas Poussin,ca. 1633,French,France,1600's,European Paintings
437328,Midas Washing at the Source of the Pactolus,Nicolas Poussin,ca. 1627,French,France,1600's,European Paintings
437329,The Abduction of the Sabine Women,Nicolas Poussin,probably 1633–34,French,France,1600's,European Paintings
437330,Saints Peter and John Healing the Lame Man,Nicolas Poussin,1655,French,France,1600's,European Paintings
437331,Orpheus and Eurydice,Nicolas Poussin,Unavailable,French,France,Unavailable,European Paintings
437332,Girl with Cherries,Marco d'Oggiono,ca. 1491–95,unavailable,Unknown,1400's,European Paintings
437333,Pilate Washing His Hands,Mattia Preti (Il Cavalier Calabrese),1663,Italian,Italy,1600's,European Paintings
437336,Madonna and Child with Saints Francis and Dominic and Angels,Giulio Cesare Procaccini,Unavailable,Italian,Italy,Unavailable,European Paintings
437339,Andromache and Astyanax,Pierre Paul Prud'hon,?1813–17; 1823–24?,French,France,1800's,European Paintings
437340,"Charles Maurice de Talleyrand Périgord (1754–1838), Prince de Talleyrand",Pierre Paul Prud'hon,1817,French,France,1800's,European Paintings
437344,The Shepherd's Song,Pierre Puvis de Chavannes,1891,French,France,1800's,European Paintings
437349,Sleep,Pierre Puvis de Chavannes,ca. 1867–70,French,France,1800's,European Paintings
437350,Tamaris,Pierre Puvis de Chavannes,ca. 1886–87,French,France,1800's,European Paintings
437351,Paul and Barnabas at Lystra,Jacob Pynas,Unavailable,Dutch,Netherlands,Unavailable,European Paintings
437352,A Party of Merrymakers,Pieter Jansz. Quast,ca. 1635–38,Dutch,Netherlands,1600's,European Paintings
437354,The Drummond Children,Sir Henry Raeburn,ca. 1808–9,"British, Scottish",Britain,1800's,European Paintings
437355,George Harley Drummond (1783–1855),Sir Henry Raeburn,ca. 1808–9,"British, Scottish",Britain,1800's,European Paintings
437356,Alexander Maconochie (1777–1861) of Meadowbank,Sir Henry Raeburn,Unavailable,"British, Scottish",Britain,Unavailable,European Paintings
437357,James Johnston of Straiton (died 1841),Sir Henry Raeburn,Unavailable,"British, Scottish",Britain,Unavailable,European Paintings
437358,Janet Law,Sir Henry Raeburn,Unavailable,"British, Scottish",Britain,Unavailable,European Paintings
437359,John Gray (1731–1811) of Newholm,Sir Henry Raeburn,Unavailable,"British, Scottish",Britain,Unavailable,European Paintings
437360,"Lady Maitland (Catherine Connor, died 1865)",Sir Henry Raeburn,Unavailable,"British, Scottish",Britain,Unavailable,European Paintings
437361,"Mrs. Richard Alexander Oswald (Louisa Johnston, ?born about 1760, died 1797)",Sir Henry Raeburn,ca. 1794,"British, Scottish",Britain,1700's,European Paintings
437363,William Forsyth (1749–1814),Sir Henry Raeburn,ca. 1800,"British, Scottish",Britain,1800's,European Paintings
437364,William Scott-Elliot of Arkleton (1811–1901),Sir Henry Raeburn,ca. 1815–16,"British, Scottish",Britain,1800's,European Paintings
437365,"William Robertson (1753–1835), Lord Robertson",Sir Henry Raeburn,1805,"British, Scottish",Britain,1800's,European Paintings
437368,Holy Family with an Angel,Raffaellino del Garbo (also known as Raffaelle de' Capponi and Raffaelle de' Carli),ca. 1490,Italian,Italy,1400's,European Paintings
437371,The Agony in the Garden,Raphael (Raffaello Sanzio or Santi),ca. 1504,Italian,Italy,1500's,European Paintings
437373,"Giuliano de' Medici (1479–1516), Duke of Nemours",Raphael,Unavailable,unavailable,Unknown,Unavailable,European Paintings
437376,A Cat Stealing Fish,Giuseppe Recco,late 1660s,Italian,Italy,1600's,European Paintings
437378,Bouquet in a Chinese Vase,Odilon Redon,ca. 1912–14,French,France,1900's,European Paintings
437380,The Chariot of Apollo,Odilon Redon,1905–16,French,France,1900's,European Paintings
437381,Etruscan Vase with Flowers,Odilon Redon,1900–1910,French,France,1900's,European Paintings
437382,Vase of Flowers (Pink Background),Odilon Redon,ca. 1906,French,France,1900's,European Paintings
437384,Salome,Henri Regnault,1870,French,France,1800's,European Paintings
437385,Man in a Turban,Rembrandt (Rembrandt van Rijn),1632,Dutch,Netherlands,1600's,European Paintings
437386,"Portrait of a Man, probably a Member of the Van Beresteyn Family",Rembrandt (Rembrandt van Rijn),1632,Dutch,Netherlands,1600's,European Paintings
437388,"Portrait of a Woman, probably a Member of the Van Beresteyn Family",Rembrandt (Rembrandt van Rijn),1632,Dutch,Netherlands,1600's,European Paintings
437389,Bellona,Rembrandt (Rembrandt van Rijn),1633,Dutch,Netherlands,1600's,European Paintings
437391,Portrait of a Young Woman with a Fan,Rembrandt (Rembrandt van Rijn),1633,Dutch,Netherlands,1600's,European Paintings
437392,Herman Doomer (ca. 1595–1650),Rembrandt (Rembrandt van Rijn),1640,Dutch,Netherlands,1600's,European Paintings
437393,The Toilet of Bathsheba,Rembrandt (Rembrandt van Rijn),1643,Dutch,Netherlands,1600's,European Paintings
437394,Aristotle with a Bust of Homer,Rembrandt (Rembrandt van Rijn),1653,Dutch,Netherlands,1600's,European Paintings
437395,"The Standard Bearer (Floris Soop, 1604–1657)",Rembrandt (Rembrandt van Rijn),1654,Dutch,Netherlands,1600's,European Paintings
437396,Hendrickje Stoffels (1626–1663),Rembrandt (Rembrandt van Rijn),mid-1650s,Dutch,Netherlands,1600's,European Paintings
437398,Flora,Rembrandt (Rembrandt van Rijn),ca. 1654,Dutch,Netherlands,1600's,European Paintings
437399,Man with a Magnifying Glass,Rembrandt (Rembrandt van Rijn),early 1660s,Dutch,Netherlands,1600's,European Paintings
437401,Portrait of a Man Holding Gloves,Rembrandt (Rembrandt van Rijn),1648,Dutch,Netherlands,1600's,European Paintings
437402,Woman with a Pink,Rembrandt (Rembrandt van Rijn),early 1660s,Dutch,Netherlands,1600's,European Paintings
437403,Christ and the Woman of Samaria,Rembrandt,Unavailable,Dutch,Netherlands,Unavailable,European Paintings
437405,A Young Woman as a Shepherdess,Govert Flinck,Unavailable,Dutch,Netherlands,Unavailable,European Paintings
437406,"Portrait of a Man (""The Auctioneer"")",Rembrandt,probably ca. 1658–62,Dutch,Netherlands,1600's,European Paintings
437407,Christ with a Staff,Rembrandt,Unavailable,Dutch,Netherlands,Unavailable,European Paintings
437408,Man in a Beret,Rembrandt,Unavailable,Dutch,Netherlands,Unavailable,European Paintings
437410,Portrait of a Man with a Breastplate and Plumed Hat,Rembrandt,Unavailable,Dutch,Netherlands,Unavailable,European Paintings
437411,Man with a Steel Gorget,Rembrandt,Unavailable,Dutch,Netherlands,Unavailable,European Paintings
437412,Old Woman Cutting Her Nails,Rembrandt,ca. 1655–60,Dutch,Netherlands,1600's,European Paintings
437413,Man in a Red Cloak,Rembrandt,Unavailable,Dutch,Netherlands,Unavailable,European Paintings
437415,The Sibyl,Willem Drost,ca. 1654,Dutch,Netherlands,1600's,European Paintings
437416,Man in Armor (Mars?),Rembrandt,Unavailable,Dutch,Netherlands,Unavailable,European Paintings
437417,"Lieven Willemsz van Coppenol (born about 1599, died 1671 or later)",Rembrandt (Rembrandt van Rijn),Unavailable,Dutch,Netherlands,Unavailable,European Paintings
437418,Man with a Beard,Rembrandt,Unavailable,Dutch,Netherlands,Unavailable,European Paintings
437419,Rembrandt (1606–1669) as a Young Man,Rembrandt,Unavailable,Dutch,Netherlands,Unavailable,European Paintings
437420,Rembrandt's Son Titus (1641–1668),Rembrandt,Unavailable,Dutch,Netherlands,Unavailable,European Paintings
437421,Study Head of an Old Man,Rembrandt,Unavailable,Dutch,Netherlands,Unavailable,European Paintings
437423,The Immaculate Conception,Guido Reni,1627,Italian,Italy,1600's,European Paintings
437424,"Madame Édouard Bernier (Marie-Octavie-Stéphanie Laurens, 1838–1920)",Auguste Renoir,1871,French,France,1800's,European Paintings
437425,Marguerite-Thérèse (Margot) Berard (1874–1956),Auguste Renoir,1879,French,France,1800's,European Paintings
437426,View of the Seacoast near Wargemont in Normandy,Auguste Renoir,1880,French,France,1800's,European Paintings
437427,The Bay of Naples,Auguste Renoir,1881,French,France,1800's,European Paintings
437428,Still Life with Peaches and Grapes,Auguste Renoir,1881,French,France,1800's,European Paintings
437429,Still Life with Peaches,Auguste Renoir,1881,French,France,1800's,European Paintings
437430,By the Seashore,Auguste Renoir,1883,French,France,1800's,European Paintings
437431,"Hills around the Bay of Moulin Huet, Guernsey",Auguste Renoir,1883,French,France,1800's,European Paintings
437432,"Tilla Durieux (Ottilie Godeffroy, 1880–1971)",Auguste Renoir,1914,French,France,1900's,European Paintings
437433,"The Farm at Les Collettes, Cagnes",Auguste Renoir,1908–14,French,France,1900's,European Paintings
437434,In the Meadow,Auguste Renoir,1888–92,French,France,1800's,European Paintings
437436,A Road in Louveciennes,Auguste Renoir,ca. 1870,French,France,1800's,European Paintings
437437,A Waitress at Duval's Restaurant,Auguste Renoir,ca. 1875,French,France,1800's,European Paintings
437438,Young Girl in a Pink-and-Black Hat,Auguste Renoir,ca. 1891,French,France,1800's,European Paintings
437439,A Young Girl with Daisies,Auguste Renoir,1889,French,France,1800's,European Paintings
437443,"Thomas (1740–1825) and Martha Neate (1741–after 1795) with His Tutor, Thomas Needham",Sir Joshua Reynolds,1748,British,Britain,1700's,European Paintings
437444,"Anne Dashwood (1743–1830), Later Countess of Galloway",Sir Joshua Reynolds,1764,British,Britain,1700's,European Paintings
437445,"George Capel, Viscount Malden (1757–1839), and Lady Elizabeth Capel (1755–1834)",Sir Joshua Reynolds,1768,British,Britain,1700's,European Paintings
437446,"Mrs. Horton, Later Viscountess Maynard (died 1814/15)",Sir Joshua Reynolds,Unavailable,British,Britain,Unavailable,European Paintings
437447,Captain George K. H. Coussmaker (1759–1801),Sir Joshua Reynolds,1782,British,Britain,1700's,European Paintings
437448,"Georgiana Augusta Frederica Elliott (1782–1813), Later Lady Charles Bentinck",Sir Joshua Reynolds,1784,British,Britain,1700's,European Paintings
437449,The Honorable Henry Fane (1739–1802) with Inigo Jones and Charles Blair,Sir Joshua Reynolds,1761–66,British,Britain,1700's,European Paintings
437450,"Mrs. Lewis Thomas Watson (Mary Elizabeth Milles, 1767–1818)",Sir Joshua Reynolds,1789,British,Britain,1700's,European Paintings
437451,John Barker (1707–1787),Sir Joshua Reynolds,1786,British,Britain,1700's,European Paintings
437452,"Lady Smith (Charlotte Delaval) and Her Children (George Henry, Louisa, and Charlotte)",Sir Joshua Reynolds,1787,British,Britain,1700's,European Paintings
437454,"Mrs. George Baldwin (Jane Maltass, 1763–1839)",Sir Joshua Reynolds,1782 or later,British,Britain,1700's,European Paintings
437455,The Holy Family with Saints Anne and Catherine of Alexandria,Jusepe de Ribera (called Lo Spagnoletto),1648,Spanish,Spain,1600's,European Paintings
437456,Breton Fishermen and Their Families,Théodule-Augustin Ribot,possibly ca. 1880–85,French,France,1800's,European Paintings
437458,The Holy Family with Angels,Sebastiano Ricci,ca. 1700,Italian,Italy,1700's,European Paintings
437460,A Canal in Venice,Martín Rico y Ortega,1879,Spanish,Spain,1800's,European Paintings
437461,On the Seine,Martín Rico y Ortega,1869,Spanish,Spain,1800's,European Paintings
437462,A Spanish Garden,Martín Rico y Ortega,1871,Spanish,Spain,1800's,European Paintings
437463,Portrait of a General Officer,Hyacinthe Rigaud,ca. 1710,French,France,1700's,European Paintings
437464,Louis XV (1710–1774) as a Child,Hyacinthe Rigaud,ca. 1716–24,unavailable,Unknown,1700's,European Paintings
437468,The Portico of a Country Mansion,Hubert Robert,1773,French,France,1700's,European Paintings
437471,Aqueduct in Ruins,Hubert Robert,Unavailable,French,France,Unavailable,European Paintings
437473,The Bathing Pool,Hubert Robert,Unavailable,French,France,Unavailable,European Paintings
437474,Bridge over a Cascade,Hubert Robert,Unavailable,French,France,Unavailable,European Paintings
437479,The Return of the Cattle,Hubert Robert,ca. 1773–75,French,France,1700's,European Paintings
437480,The Swing,Hubert Robert,Unavailable,French,France,Unavailable,European Paintings
437481,Wandering Minstrels,Hubert Robert,Unavailable,French,France,Unavailable,European Paintings
437487,"Francesco d'Este (born about 1429, died after July 20, 1486)",Rogier van der Weyden,ca. 1460,Netherlandish,Netherlands,1400's,European Paintings
437488,Portrait of a Man in a Chaperon,Netherlandish Painter,Unavailable,unavailable,Unknown,Unavailable,European Paintings
437492,The Holy Family with Saint Paul and a Donor,Rogier van der Weyden,Unavailable,Netherlandish,Netherlands,Unavailable,European Paintings
437494,"Friedrich I (1460–1536), Margrave of Brandenburg-Ansbach",Franz Wolfgang Rohrich,Unavailable,German,Germany,Unavailable,European Paintings
437495,Sophia (1464–1512) of Poland,Franz Wolfgang Rohrich,Unavailable,German,Germany,Unavailable,European Paintings
437496,The Sacrifice of Polyxena,Giovanni Francesco Romanelli,Unavailable,Italian,Italy,Unavailable,European Paintings
437497,The Flagellation; (reverse) The Madonna of Mercy,Girolamo Romanino,ca. 1540,Italian,Italy,1500's,European Paintings
437498,"Portrait of a Woman, Said to Be Emily Bertie Pott (died 1782)",George Romney,1781,British,Britain,1700's,European Paintings
437500,"Lady Elizabeth Stanley (1753–1797), Countess of Derby",George Romney,1776–78,British,Britain,1700's,European Paintings
437501,"Mrs. Bryan Cooke (Frances Puleston, 1765–1818)",George Romney,ca. 1787–91,British,Britain,1700's,European Paintings
437502,"Mrs. Charles Frederick (Martha Rigden, died 1794)",George Romney,Unavailable,British,Britain,Unavailable,European Paintings
437503,"Mrs. George Horsley (Charlotte Mary Talbot, died 1828)",John Westbrooke Chandler,Unavailable,British,Britain,Unavailable,European Paintings
437505,Admiral Sir Chaloner Ogle (1726–1816),George Romney,Unavailable,British,Britain,Unavailable,European Paintings
437506,Bandits on a Rocky Coast,Salvator Rosa,1655–60,Italian,Italy,1600's,European Paintings
437507,The Dream of Aeneas,Salvator Rosa,1660–65,Italian,Italy,1600's,European Paintings
437512,The Banks of the Bièvre near Bicêtre,Henri Rousseau (le Douanier),ca. 1908–09,French,France,1900's,European Paintings
437513,Still Life with Ham,Philippe Rousseau,1870s,French,France,1800's,European Paintings
437514,"The Edge of the Woods at Monts-Girard, Fontainebleau Forest",Théodore Rousseau,1852–54,French,France,1800's,European Paintings
437515,A Meadow Bordered by Trees,Théodore Rousseau,ca. 1845,French,France,1800's,European Paintings
437516,An Old Chapel in a Valley,Théodore Rousseau,ca. 1835,French,France,1800's,European Paintings
437517,A Path among the Rocks,Théodore Rousseau,probably 1861,French,France,1800's,European Paintings
437518,A River in a Meadow,Théodore Rousseau,ca. 1840,French,France,1800's,European Paintings
437519,A River Landscape,Théodore Rousseau,Unavailable,French,France,Unavailable,European Paintings
437520,Sunset near Arbonne,Théodore Rousseau,ca. 1860–65,French,France,1800's,European Paintings
437523,Atalanta and Meleager,Peter Paul Rubens,ca. 1616,Flemish,Belgium,1600's,European Paintings
437525,The Feast of Acheloüs,Peter Paul Rubens,ca. 1615,Flemish,Belgium,1600's,European Paintings
437526,A Forest at Dawn with a Deer Hunt,Peter Paul Rubens,ca. 1635,Flemish,Belgium,1600's,European Paintings
437527,The Glorification of the Eucharist,Peter Paul Rubens,ca. 1630–32,Flemish,Belgium,1600's,European Paintings
437528,The Holy Family with Saints Francis and Anne and the Infant Saint John the Baptist,Peter Paul Rubens,early or mid-1630s,Flemish,Belgium,1600's,European Paintings
437529,"The Holy Family with Saint Elizabeth, Saint John, and a Dove",Peter Paul Rubens,ca. 1608–9,Flemish,Belgium,1600's,European Paintings
437530,"Portrait of a Man, Possibly an Architect or Geographer",Peter Paul Rubens,1597,Flemish,Belgium,1500's,European Paintings
437531,"Portrait of a Woman, Probably Susanna Lunden (Susanna Fourment, 1599–1628)",Peter Paul Rubens,ca. 1625–27,Flemish,Belgium,1600's,European Paintings
437532,"Rubens, Helena Fourment (1614–1673), and Their Son Frans (1633–1678)",Peter Paul Rubens,ca. 1635,Flemish,Belgium,1600's,European Paintings
437533,Study of Two Heads,Peter Paul Rubens,ca. 1609,Flemish,Belgium,1600's,European Paintings
437534,The Triumph of Henry IV,Peter Paul Rubens,ca. 1630,Flemish,Belgium,1600's,European Paintings
437535,Venus and Adonis,Peter Paul Rubens,probably mid-1630s,Flemish,Belgium,1600's,European Paintings
437536,Wolf and Fox Hunt,Peter Paul Rubens,ca. 1616,Flemish,Belgium,1600's,European Paintings
437539,Cambyses Appointing Otanes Judge,Peter Paul Rubens,Unavailable,Flemish,Belgium,Unavailable,European Paintings
437540,Frans Francken I (1542–1616),Peter Paul Rubens,Unavailable,Flemish,Belgium,Unavailable,European Paintings
437542,Saint Teresa of Ávila Interceding for Souls in Purgatory,Peter Paul Rubens,Unavailable,Flemish,Belgium,Unavailable,European Paintings
437543,Susanna and the Elders,Peter Paul Rubens,Unavailable,Flemish,Belgium,Unavailable,European Paintings
437545,Landscape with a Village in the Distance,Jacob van Ruisdael,1646,Dutch,Netherlands,1600's,European Paintings
437546,The Forest Stream,Jacob van Ruisdael,ca. 1660,Dutch,Netherlands,1600's,European Paintings
437547,Grainfields,Jacob van Ruisdael,mid- or late 1660s,Dutch,Netherlands,1600's,European Paintings
437548,Mountain Torrent,Jacob van Ruisdael,1670s,Dutch,Netherlands,1600's,European Paintings
437549,Wheat Fields,Jacob van Ruisdael,ca. 1670,Dutch,Netherlands,1600's,European Paintings
437552,The Protection of the Mother of God,Russian Painter,Unavailable,Russian,Russia,Unavailable,European Paintings
437555,The Congregation of the Mother of God,Russian Painter,Unavailable,Russian,Russia,Unavailable,European Paintings
437556,Saint Elias's Fiery Ascension,Russian Painter,Unavailable,Russian,Russia,Unavailable,European Paintings
437557,Panel from a Saints' Calendar (painted on both sides),Russian Painter,Unavailable,Russian,Russia,Unavailable,European Paintings
437558,Saint George,Russian Painter,Unavailable,Russian,Russia,Unavailable,European Paintings
437559,The Christ Child with Saints Boris and Gleb,Russian Painter,Unavailable,Russian,Russia,Unavailable,European Paintings
437560,Saints Boris and Gleb,Russian Painter,Unavailable,Russian,Russia,Unavailable,European Paintings
437564,The Resurrection of Christ and the Harrowing of Hell,Russian Painter,Unavailable,Russian,Russia,Unavailable,European Paintings
437566,Christ's Entry into Jerusalem,Russian Painter,Unavailable,Russian,Russia,Unavailable,European Paintings
437568,Three Female Saints,Russian Painter,Unavailable,Russian,Russia,Unavailable,European Paintings
437578,Christ in Glory,Russian (Novgorod?) Painter,Unavailable,Russian,Russia,Unavailable,European Paintings
437585,Market by the Seashore,Salomon van Ruysdael,1637,Dutch,Netherlands,1600's,European Paintings
437586,A Country Road,Salomon van Ruysdael,1648,Dutch,Netherlands,1600's,European Paintings
437587,Marine,Salomon van Ruysdael,1650,Dutch,Netherlands,1600's,European Paintings
437588,Drawing the Eel,Salomon van Ruysdael,early 1650s,Dutch,Netherlands,1600's,European Paintings
437589,Ferry near Gorinchem,Salomon van Ruysdael,1646,Dutch,Netherlands,1600's,European Paintings
437590,View of the Town of Alkmaar,Salomon van Ruysdael,Unavailable,Dutch,Netherlands,Unavailable,European Paintings
437591,Rustic Interior,David Ryckaert III,Unavailable,Flemish,Belgium,Unavailable,European Paintings
437592,The Yard of the Inn at Emmaus,David Ryckaert III,Unavailable,Flemish,Belgium,Unavailable,European Paintings
437593,Marcantonio Pasqualini (1614–1691) Crowned by Apollo,Andrea Sacchi,1641,Italian,Italy,1600's,European Paintings
437606,The Massacre of the Innocents,Sano di Pietro (Ansano di Pietro di Mencio),ca. 1470,Italian,Italy,1400's,European Paintings
437608,Head of the Madonna,Franciabigio (Francesco di Cristofano),ca. 1509,Italian,Italy,1500's,European Paintings
437609,The Holy Family with the Young Saint John the Baptist,Andrea del Sarto (Andrea d'Agnolo),ca. 1528,Italian,Italy,1500's,European Paintings
437611,The Journey of the Magi,Sassetta (Stefano di Giovanni),ca. 1433–35,Italian,Italy,1400's,European Paintings
437630,Saint Matthew and the Angel,Giovanni Gerolamo Savoldo,Unavailable,Italian,Italy,Unavailable,European Paintings
437631,Night Scene on the Volga,Alexei Kondratievich Savrasov,1871,Russian,Russia,1800's,European Paintings
437633,Cephalus and Procris,Godfried Schalcken,probably 1680s,Dutch,Netherlands,1600's,European Paintings
437636,Domestic Scene,German Painter,Unavailable,German,Germany,Unavailable,European Paintings
437637,Lost: Souvenir of Auvergne,August Friedrich Albrecht Schenck,Unavailable,Danish,Denmark,Unavailable,European Paintings
437638,The Marriage of Cupid and Psyche,Andrea Schiavone (Andrea Meldola),ca. 1540,Italian,Italy,1500's,European Paintings
437639,Christ before Pilate; The Resurrection,Ludwig Schongauer,Unavailable,German,Germany,Unavailable,European Paintings
437640,Baron Alexander von Humboldt (1769–1859),Julius Schrader,1859,German,Germany,1800's,European Paintings
437641,Arabs on the March,Adolf Schreyer,Unavailable,German,Germany,Unavailable,European Paintings
437642,Battle Scene: Arabs Making a Detour,Adolf Schreyer,Unavailable,German,Germany,Unavailable,European Paintings
437643,The Building of Westminster Bridge,Samuel Scott,Unavailable,British,Britain,Unavailable,European Paintings
437645,"Portrait of a Man, Said to be Christopher Columbus (born about 1446, died 1506)",Sebastiano del Piombo (Sebastiano Luciani),1519,Italian,Italy,1500's,European Paintings
437646,Madonna and Child with Saints and Donors,Sebastiano del Piombo,Unavailable,Italian,Italy,Unavailable,European Paintings
437647,Spring in Brittany,Paul Sébillot,1874,French,France,1800's,European Paintings
437648,Sir James Dashwood (1715–1779),Enoch Seeman the Younger,1737,German,Germany,1700's,European Paintings
437649,Christ Blessing,Segna di Buonaventura,ca. 1311,Italian,Italy,1300's,European Paintings
437652,The Virgin Adoring the Child with the Infant Saint John the Baptist,Jacopo di Arcangelo (called Jacopo del Sellaio),late 1480s,Italian,Italy,1400's,European Paintings
437654,Circus Sideshow (Parade de cirque),Georges Seurat,1887–88,French,France,1800's,European Paintings
437655,The Forest at Pontaubert,Georges Seurat,1881,French,France,1800's,European Paintings
437656,The Gardener,Georges Seurat,1882–83,French,France,1800's,European Paintings
437657,Landscape at Saint-Ouen,Georges Seurat,1878 or 1879,French,France,1800's,European Paintings
437658,"Study for ""A Sunday on La Grande Jatte""",Georges Seurat,1884,French,France,1800's,European Paintings
437659,View of the Seine,Georges Seurat,1882–83,French,France,1800's,European Paintings
437660,Portrait of a Horseman,James Seymour,Unavailable,British,Britain,Unavailable,European Paintings
437662,"William Archer Shee (1810–1899), the Artist's Son",Sir Martin Archer Shee,ca. 1820,Irish,Ireland,1800's,European Paintings
437673,The Assumption of the Virgin with Saints Michael and Benedict,Luca Signorelli,ca. 1493–96,Italian,Italy,1400's,European Paintings
437677,Saint Bartholomew,Simone Martini,ca. 1317–19,Italian,Italy,1300's,European Paintings
437678,Saint Matthias,Simone Martini,ca. 1317–19,Italian,Italy,1300's,European Paintings
437679,Saint Thomas,Simone Martini,ca. 1317–19,Italian,Italy,1300's,European Paintings
437680,The Bridge at Villeneuve-la-Garenne,Alfred Sisley,1872,British,Britain,1800's,European Paintings
437682,View of Marly-le-Roi from Coeur-Volant,Alfred Sisley,1876,British,Britain,1800's,European Paintings
437683,Sahurs Meadows in Morning Sun,Alfred Sisley,1894,British,Britain,1800's,European Paintings
437684,The Road from Moret to Saint-Mammès,Alfred Sisley,1883–85,British,Britain,1800's,European Paintings
437685,The Road from Versailles to Louveciennes,Alfred Sisley,probably 1879,British,Britain,1800's,European Paintings
437686,Rue Eugène Moussoir at Moret: Winter,Alfred Sisley,1891,British,Britain,1800's,European Paintings
437687,Johan Hulshout (1623–1687),Pieter van Slingelandt,ca. 1670 or slightly later,Dutch,Netherlands,1600's,European Paintings
437697,Soldiers Bivouacking,Pieter Snayers,Unavailable,Flemish,Belgium,Unavailable,European Paintings
437699,Salome with the Head of Saint John the Baptist,Andrea Solario,ca. 1507–9,Italian,Italy,1500's,European Paintings
437701,Diego Pignatelli d'Aragona (1687–1750) and an Enslaved African Servant,Francesco Solimena,probably 1731 or 1732,Italian,Italy,1700's,European Paintings
437703,A Kitchen,Hendrick Sorgh,ca. 1643,Dutch,Netherlands,1600's,European Paintings
437722,The Mass of Saint Gregory,Spanish Painter,Unavailable,Spanish,Spain,Unavailable,European Paintings
437724,Virgin and Child Enthroned with Saints Catherine and Jerome,Spanish Painter,Unavailable,Spanish,Spain,Unavailable,European Paintings
437725,"Doña Marianna Stampa Parravicina (born 1612), Condesa di Segrate",Spanish Painter,Unavailable,unavailable,Unknown,Unavailable,European Paintings
437729,Saint Michael the Archangel,Ignacio de Ries,1640s,Spanish,Spain,1600's,European Paintings
437738,The Beheading of Saint John the Baptist,Spanish (Catalan) Painter,Unavailable,Spanish,Spain,Unavailable,European Paintings
