objectID,Title,ArtistName,TimePeriod,Region Detailed,Country,Century,Culture,Height,Width,H/W Ratio,Color
35968,Forts Zeelandia and Provintia and the City of Tainan,Unidentified artist,19th century,China,China,1900's,Asian Art,3947,3059,1.290290945,RGB
35970,Song of the Lute,Ding Yunpeng,1585,China,China,1500's,Asian Art,4000,3166,1.263423879,RGB
35971,Landscape after Li Cheng,Unidentified artist,"18th century or later, spurious date of 1680",China,China,1800's,Asian Art,550,716,0.768156425,RGB
36005,"Mountain Market, Clearing Mist",Xia Gui,early 13th century,China,China,1300's,Asian Art,1108,1189,0.931875526,RGB
36011,First half of Ten Thousand Li of the Yangzi River,Unidentified artist,late 15th century,China,China,1500's,Asian Art,1976,1542,1.281452659,RGB
36013,Lady in a Bamboo Grove,Qiu Ying,Unavailable,China,China,Unavailable,Asian Art,3000,4000,0.75,RGB
36018,(Copy after) The Sixteen Luohans,Shitao (Zhu Ruoji),19th–early 20th century,China,China,1900's,Asian Art,1848,1266,1.45971564,RGB
36020,Pomegranates after Ma Lin,Unidentified artist,Unavailable,China,China,Unavailable,Asian Art,3682,3722,0.98925309,RGB
36023,Fisherman and family,Zhang Lu,16th century,China,China,1600's,Asian Art,511,700,0.73,RGB
36026,Spring Ablutions at the Orchid Pavilion,Wang Wenzhi,Unavailable,China,China,Unavailable,Asian Art,2000,1760,1.136363636,RGB
36028,Children Playing,Unidentified,16th–17th century,China,China,1600's,Asian Art,2389,3653,0.653983028,RGB
36029,Water-moon Avalokiteshvara,Unidentified artist,first half of the 14th century,Korea,Korea,1400's,Asian Art,2050,4000,0.5125,RGB
36030,Lady in a Bamboo Grove after Qiu Ying,Shen Shuo,Unavailable,China,China,Unavailable,Asian Art,1500,2000,0.75,RGB
36035,Rosy Sunset,Wen Tong,16th century,China,China,1600's,Asian Art,1881,1464,1.284836066,RGB
36036,Hibiscus and Egret,Jiang Tingxi,dated 1724,China,China,1700's,Asian Art,2216,4000,0.554,RGB
36037,Viewing the Moon under a Pine Tree,Ma Yuan,early 13th century,China,China,1300's,Asian Art,3787,3409,1.110882957,RGB
36039,Horse and Willow Tree,Unidentified artist,early 15th century,China,China,1500's,Asian Art,1628,1827,0.89107827,RGB
36040,Four Deities with Horses,Unidentified,Unavailable,Japan,Japan,Unavailable,Asian Art,1473,1777,0.828925155,RGB
36042,Dragon and Landscape,Unidentified artist,14th century; plus later addition,China,China,1400's,Asian Art,4000,3002,1.332445037,RGB
36043,Bird,Ogawa Haritsu (Ritsuō),18th century,Japan,Japan,1800's,Asian Art,4000,2803,1.427042455,RGB
36047,Miniature landscapes,Zhang Zongcang,datable to 1751–54,China,China,1700's,Asian Art,3067,2703,1.134665187,RGB
36054,Landscape with Birds,Unidentified artist,16th century?,China,China,1600's,Asian Art,485,853,0.568581477,RGB
36055,Landscape with great pine,Ma Lin,second quarter of the 13th century,China,China,1300's,Asian Art,3851,3648,1.05564693,RGB
36058,Prunus,Zhou Zonglian,dated 1532 or 1592,China,China,1500's,Asian Art,480,878,0.546697039,RGB
36059,Flowers and Butterflies,Ma Quan,Unavailable,China,China,Unavailable,Asian Art,3811,2243,1.699063754,RGB
36063,Wild Geese in Winter,Unidentified artist,13th century,China,China,1300's,Asian Art,1718,1893,0.907554147,RGB
36065,Man Sleeping on a Bamboo Couch,Unidentified artist,Unavailable,China,China,Unavailable,Asian Art,1925,1683,1.14379085,RGB
36066,Portraits of Emperors of Successive Dynasties,Unidentified artist,early 20th century (?),China,China,2000's,Asian Art,3136,3407,0.920457881,RGB
36067,"Spring Landscape with Plum Blossoms, Scholar and Deer",Xie Shichen,dated 1548,China,China,1500's,Asian Art,1136,1936,0.58677686,RGB
36081,Portrait of the Artist's Great-Granduncle Yizhai at the Age of Eighty-Five,Ruan Zude,"dated ""xinyou"" (1561 or 1621?)",China,China,1500's,Asian Art,2556,4000,0.639,RGB
36082,Portrait of an Old Lady,Ruan Zude,"dated ""xinyou"" (1561 or 1621?)",China,China,1500's,Asian Art,2554,4000,0.6385,RGB
36083,The Sixteen Luohans,Chen Xian,spurious date of 1634,China or Japan,Japan,1600's,Asian Art,4000,3417,1.170617501,RGB
36084,Flowering Plum in Moonlight and Snow,Liu Shiru,16th century,China,China,1600's,Asian Art,1422,2200,0.646363636,RGB
36089,"Autumn Landscape, leaf from Album for Zhou Lianggong",Xiang Shengmo,1654,China,China,1600's,Asian Art,3896,2930,1.329692833,RGB
36090,"White Crane Mountain, leaf from Album for Zhou Lianggong",Ye Xin,datable to 1654–55,China,China,1600's,Asian Art,1923,1509,1.274353877,RGB
36091,"Mountain Retreat,  leaf from Album for Zhou Lianggong",Shi Lin,datable to 1654–55,China,China,1600's,Asian Art,3857,2945,1.309677419,RGB
36093,Landscape for Zhao Yipeng,Tang Yin,late 15th–early 16th century,China,China,1500's,Asian Art,2576,3894,0.66153056,RGB
36103,Eight Songs of the Xiao and Xiang Rivers,Wen Zhengming,Unavailable,China,China,Unavailable,Asian Art,3141,3275,0.959083969,RGB
36105,"Cranes, Peach Tree, and Chinese Roses",Shen Quan,early 18th century,China,China,1800's,Asian Art,1247,2000,0.6235,RGB
36106,Flowers and Birds,Shen Quan,1750,China,China,1700's,Asian Art,2135,3880,0.550257732,RGB
36107,Ema (Votive Painting) of Chinese Lion Led by Utenō,Unavailable,dated 1627,Japan,Japan,1600's,Asian Art,3893,3060,1.272222222,RGB
36109,Ema (Votive Painting) of Chinese Lion and Peony Tree,Unavailable,1649,Japan,Japan,1600's,Asian Art,4000,3366,1.18835413,RGB
36112,Ōtsu-e of Thirteen Buddhist Deities,Unavailable,17th century,Japan,Japan,1700's,Asian Art,3000,4000,0.75,RGB
36120,Washing the White Elephant,Chen Zi,Unavailable,China,China,Unavailable,Asian Art,1261,2272,0.555017606,RGB
36129,Landscapes Painted for Wang Kui,Wang Jian,1674–76,China,China,1600's,Asian Art,2000,1567,1.276324186,RGB
36131,Landscapes with poems,Gong Xian,1688,China,China,1600's,Asian Art,1000,692,1.445086705,RGB
36133,View From a Mountain Pavilion,Li Yin,1700,China,China,1700's,Asian Art,422,825,0.511515152,RGB
36136,Spring Breeze of Myriad Pasts,Zhang You,Unavailable,China,China,Unavailable,Asian Art,3000,4000,0.75,RGB
36137,Gibbons and Deer,Unidentified artist,Unavailable,China,China,Unavailable,Asian Art,3807,3113,1.222936075,RGB
36138,Listening to the Zither Among Streams and Pines,Xie Shichen,Unavailable,China,China,Unavailable,Asian Art,1139,2219,0.513294277,RGB
36146,Copy of a Portrait of Zhao Mengfu,Unidentified artist,19th century,China,China,1900's,Asian Art,2111,4000,0.52775,RGB
36160,Bringing the Message of Victory to Dongshan,Wang Su,1862,China,China,1800's,Asian Art,1140,2000,0.57,RGB
36168,Landscapes after old masters,Du Xiang,19th century,China,China,1900's,Asian Art,2634,4000,0.6585,RGB
36170,"Animals, Flowers and Birds",Ren Yi (Ren Bonian),19th century,China,China,1900's,Asian Art,4000,3176,1.259445844,RGB
36171,Landscapes,Zhang Zhiwan,dated 1875,China,China,1800's,Asian Art,3714,4000,0.9285,RGB
36184,Insects and Flowers,Ju Lian,Unavailable,China,China,Unavailable,Asian Art,2000,1792,1.116071429,RGB
36430,Tiger,Unidentified,14th century,China,China,1400's,Asian Art,2998,4000,0.7495,RGB
36431,Dragon,Unidentified,14th century,China,China,1400's,Asian Art,2998,4000,0.7495,RGB
36432,Plum Blossoms,Jin Nong,dated 1757,China,China,1700's,Asian Art,1882,1585,1.187381703,RGB
36433,Portrait of Ren'an in a Landscape,Shitao (Zhu Ruoji),dated 1684,China,China,1600's,Asian Art,948,629,1.507154213,RGB
36457,Grapevine in the Wind,Unidentified artist,16th century,Korea,Korea,1600's,Asian Art,2153,4000,0.53825,RGB
36459,Peacock and Hollyhocks,Bian Lu,mid-14th century,China,China,1400's,Asian Art,2241,3713,0.603555077,RGB
37393,Zhong Kui,Ren Yi (Ren Bonian),dated 1883,China,China,1800's,Asian Art,1108,1982,0.559031282,RGB
37394,Boating beneath Echo Hill,Mei Qing,datable to 1673,China,China,1600's,Asian Art,2125,3766,0.564259161,RGB
37395,Miscellaneous Studies,Chen Hongshou,one leaf dated 1619,China,China,1600's,Asian Art,3351,3849,0.870615744,RGB
37396,"Figures, flowers, and landscapes",Chen Hongshou,one leaf dated 1627,China,China,1600's,Asian Art,1697,1904,0.891281513,RGB
37793,Pair of Hindu Manuscript Covers,Unavailable,12th century,Nepal (Kathmandu Valley),Nepal,1200's,Asian Art,925,543,1.703499079,RGB
37800,Sadaksari-Lokeshvara Surrounded by Manifestations and Monks,Unavailable,late 15th century,China,China,1500's,Asian Art,2978,3722,0.800107469,RGB
37801,Portrait of Jnanatapa Attended by Lamas and Mahasiddhas,Unavailable,ca. 1350,"Eastern Tibet, Kham, Riwoche monastery",China,1300's,Asian Art,3211,4000,0.80275,RGB
37803,Mandala of Hevajra,Sakya School,16th century,China,China,1600's,Asian Art,2667,4000,0.66675,RGB
37811,Demons Fighting Over an Animal Limb,Unavailable,late 17th century,"India (Rajasthan, Bikaner or the Deccan)",India,1700's,Asian Art,2491,3811,0.653634217,RGB
37819,"Buddhist Attendant, Possibly a Dakini",Unavailable,late 18th century,Eastern Tibet,China,1800's,Asian Art,1114,1972,0.564908722,RGB
37855,Krishna's Parents Search for Him,Unavailable,ca. 1615,India,India,1600's,Asian Art,3985,3357,1.18707179,RGB
37869,A Lady Applying Henna to Her Foot,"Ustad Mohamed, son of Murad",ca. 1720–30,"India (Rajasthan, Bikaner)",India,1700's,Asian Art,2263,4000,0.56575,RGB
37873,Lady Musician Playing a Sitar,Unavailable,ca. 1800,"India (Rajasthan, Kota)",India,1800's,Asian Art,1239,2000,0.6195,RGB
37876,Portrait of Thakur Utham Ram,Unavailable,ca. 1760,"India (Rajasthan, Jhilai)",India,1700's,Asian Art,4000,3262,1.22624157,RGB
37877,Head of Krishna: cartoon for a mural of the Raslila,Sahib Ram,ca. 1800,"India (Rajasthan, Jaipur)",India,1800's,Asian Art,2713,3937,0.689103378,RGB
37878,Preparatory Study for a Portrait of Man Singh and His Harem,Unavailable,1810–15,"India (Rajasthan, Jodhpur)",India,1800's,Asian Art,3814,2657,1.435453519,RGB
37880,An Encampment of Yogis,Unavailable,ca. 1660,"India (Deccan, Aurangabad?)",India,1600's,Asian Art,2824,4000,0.706,RGB
37898,A King Seated on His Throne,Unavailable,1725,India (Gujarat),India,1700's,Asian Art,3533,2728,1.295087977,RGB
37913,Bishen Singh as a Young Man,Unavailable,ca. 1780,"India (Rajasthan, Uniara)",India,1700's,Asian Art,2779,4000,0.69475,RGB
37914,Maharana Sangram Singh Hunting Wild Boar,Unavailable,ca. 1725,"Western India, Rajasthan, Udaipur",India,1700's,Asian Art,4000,2843,1.406964474,RGB
37915,Maharana Amar Singh II or Sangram Singh Hunting Wild Boar,Unavailable,19th century,"Western India, Rajasthan, Udaipur",India,1900's,Asian Art,2697,4000,0.67425,RGB
37916,Maharana Jagat Singh II in Procession,Unavailable,ca. 1745,"India (Rajasthan, Mewar)",India,1700's,Asian Art,3041,4000,0.76025,RGB
37922,Horoscope with Floral Drawings,Unavailable,1850,"India (Madhya Pradesh, Gwalior or Indore)",India,1800's,Asian Art,3831,2675,1.432149533,RGB
37924,Double Sided Painting; Male with Flower/ Soldier,Unavailable,mid-late 19th century,India,India,1900's,Asian Art,4000,2873,1.392272885,RGB
37926,Priests before Shri Nathji,Unavailable,ca. 1820,"India (Rajasthan, Kota)",India,1800's,Asian Art,3275,4000,0.81875,RGB
37928,Seated Four-Armed Ganesha,Unavailable,ca. 1775,"India (Rajasthan, Bundi)",India,1700's,Asian Art,2688,4000,0.672,RGB
37945,Lady on a Terrace,Unavailable,18th century,"India (Punjab Hills, Chamba)",India,1800's,Asian Art,3128,4000,0.782,RGB
37959,Radha and Krishna on a Bed at Night,Unavailable,ca. 1830,"India (Punjab Hills, Sirmur)",India,1800's,Asian Art,2932,3791,0.77341071,RGB
37960,Hanuman Bearing the Mountaintop with Medicinal Herbs,Unavailable,ca. 1800,India (Rajasthan),India,1800's,Asian Art,2563,2841,0.902147131,RGB
37968,Krishna and the Gopis Take Shelter from the Rain,Unavailable,1760,"India (Rajasthan, Jaipur)",India,1700's,Asian Art,2845,3856,0.737811203,RGB
37970,"Portrait of a Lama, Possibly Dromton",Unavailable,last quarter of the 11th century,China,China,1100's,Asian Art,1440,1856,0.775862069,RGB
37971,Lineage Portrait of an Abbot,Unavailable,ca. 1350,Central Tibet,China,1300's,Asian Art,2905,3722,0.780494358,RGB
37974,Maharaja Fateh Singh Hunting Female Bears,Pannalai,dated 1917,"Western India, Rajasthan, Udaipur",India,1900's,Asian Art,4000,3274,1.221747098,RGB
37987,A Lady Gazing at Doves,Unavailable,ca. 1780–1800,"India (Punjab Hills, Mandi)",India,1700's,Asian Art,1444,1912,0.755230126,RGB
37989,The Churning of the Ocean of Milk,Unavailable,ca. 1780–90,"India (Punjab Hill, Mandi)",India,1700's,Asian Art,3726,3353,1.111243662,RGB
37990,Krishna Spying on Radha,Unavailable,ca. 1780–90,"India (Punjab Hills, Mandi)",India,1700's,Asian Art,3000,3767,0.7963897,RGB
37991,The Timid Bride,Unavailable,ca. 1800,"India (Punjab Hills, Kangra)",India,1800's,Asian Art,3235,4000,0.80875,RGB
37992,"Abhisarika Nayika, a Heroine Longing for Her Lover",Unavailable,ca. 1790–1800,"India (Punjab Hills, Kangra)",India,1700's,Asian Art,2907,4000,0.72675,RGB
37993,Lady Holding a Sparkler,Unavailable,ca. 1800,"India (Punjab Hills, Kangra)",India,1800's,Asian Art,3143,4000,0.78575,RGB
38009,Raja Balwant Singh’s Vision of Krishna and Radha,Nainsukh,ca. 1745–50,"India, Punjab Hills, kingdom of Jasrota",India,1700's,Asian Art,3200,4000,0.8,RGB
38012,Melancholy Courtesan,Unavailable,ca. 1750,"India (Rajasthan, Bundi, or Kota [?])",India,1700's,Asian Art,3119,3707,0.841381171,RGB
38013,"The Wrathful Bon Deity Walse Ngampa, One of the Five Fortress Meditational Deities",Unavailable,early 15th century,China,China,1500's,Asian Art,1500,1769,0.847936687,RGB
38016,Maharaja Sidh Sen Receiving an Embassy,A Master of the Mandi atelier,ca. 1700–10,"India (Himachal Pradesh, Mandi)",India,1700's,Asian Art,2753,3722,0.739656099,RGB
38020,Illustration from a Ragamala Series (Garland of Musical Modes),Unavailable,late 18th century,India (Punjab Hills),India,1800's,Asian Art,1314,1960,0.670408163,RGB
38022,Krishna with an Ascetic,Unavailable,ca.1850,"India (Maharashtra, Marathi)",India,1800's,Asian Art,4000,2358,1.696352841,RGB
38023,Folk Painting,Unavailable,1725,"India (Rajasthan, Marwar)",India,1700's,Asian Art,3718,2735,1.359414991,RGB
38031,Prince with Four Attendants,Sri Prathi Singh of Ratlam,late 18th–early 19th century,India (Rajasthan),India,1800's,Asian Art,2861,3826,0.747778359,RGB
38032,The Three Roads,Unavailable,ca. 1840,India (Hyderabad),India,1800's,Asian Art,3423,3796,0.901738672,RGB
38035,A Holy Man Seated on a Terrace,Unavailable,ca. 1850,"India (Punjab Hills, Kangra)",India,1800's,Asian Art,2738,3914,0.699540112,RGB
38038,A Lady Playing the Tanpura,Unavailable,ca. 1735,"India (Rajasthan, Kishangarh)",India,1700's,Asian Art,1263,2000,0.6315,RGB
38039,"Mahadevi, the Great Goddess",Unavailable,ca. 1725,"India (Rajasthan, Bikaner)",India,1700's,Asian Art,2043,3722,0.548898442,RGB
38040,Maharana Jagat Singh Hawks for Cranes,Shiva and Dayal,dated 1744,"Western India, Rajasthan, Udaipur",India,1700's,Asian Art,3781,3514,1.075981787,RGB
38041,A Prince Hunting Boars with His Retinue,Unavailable,late 18th–early 19th century,"Western India, Rajasthan, Jhilai",India,1800's,Asian Art,2000,1491,1.341381623,RGB
38042,Maharana Bhim Singh and Retinue Embark on a Hunt,Chokha,ca. 1805–10,"Western India, Rajasthan, Udaipur or Devgarh",India,1800's,Asian Art,2000,1847,1.082837033,RGB
38043,Fortified City of Ranthambhor,Bagta,ca. 1810–18,"India (Jaipur, Rajasthan)",India,1800's,Asian Art,3811,2781,1.37037037,RGB
38044,Maharaja Sardar Singh of Bikaner,Chotu,ca. 1860–70,"India (Rajasthan, Bikaner)",India,1800's,Asian Art,1113,1563,0.712092131,RGB
38045,Maharana Sangram Singh II Hunts Hares at Naramangra,Unidentified artist,ca. 1720–30,"Western India, Rajasthan, Udaipur",India,1700's,Asian Art,900,497,1.810865191,RGB
38046,Prince Padam Singh of Bikaner with His Bard Gordhar on a Terrace at Night,Bhavani Das,ca. 1725,"India, Rajasthan, Kishangarh",India,1700's,Asian Art,4000,3366,1.18835413,RGB
38048,Shah Jahan Hunting Blackbuck with Trained Cheetahs,Unavailable,1710–15,"Western India, Rajasthan, Udaipur",India,1700's,Asian Art,3855,2554,1.509397024,RGB
38052,Buddha Within a Stupa,Unavailable,16th–17th century,China,China,1600's,Asian Art,2271,3448,0.658642691,RGB
38057,Sketch with Kali and a Young Boy,Unavailable,ca. 1800,"India (Punjab Hills, Kangra?)",India,1800's,Asian Art,2813,4000,0.70325,RGB
38058,"Maharana Amar Singh II, Prince Sangram Singh and Courtiers Watch a Performance",Unavailable,ca. 1705–8,"India (Rajasthan, Mewar)",India,1700's,Asian Art,4000,3000,1.333333333,RGB
38070,The Buddha Descending from Trayastrimsa Heaven at Sankissa,Unavailable,19th century,Thailand,Thailand,1900's,Asian Art,2364,4000,0.591,RGB
38072,Lamaist Mandala,Unavailable,17th century,China,China,1700's,Asian Art,1140,1923,0.592823713,RGB
38347,Lha Mo Riding on a Donkey,Unavailable,18th century,China,China,1800's,Asian Art,1500,2000,0.75,RGB
38822,Luohans,Unidentified,17th–18th century,China,China,1700's,Asian Art,4000,3186,1.255492781,RGB
39482,Mandala of Wakamiya of Kasuga Shrine (Kasuga wakamiya mandara),Unavailable,early 14th century,Japan,Japan,1400's,Asian Art,3281,3407,0.963017317,RGB
39483,Weighing Books,Guo Xu,early 16th century,China,China,1600's,Asian Art,1322,1941,0.681092221,RGB
39536,Living Aloft: Master Liu's Retreat,Wen Zhengming,1543,China,China,1500's,Asian Art,1297,2000,0.6485,RGB
39540,Two eagles,Bada Shanren (Zhu Da),dated 1702,China,China,1700's,Asian Art,2290,4000,0.5725,RGB
39542,Riverbank,Dong Yuan,Unavailable,China,China,Unavailable,Asian Art,2778,4000,0.6945,RGB
39543,Palace banquet,Unidentified artist,Unavailable,China,China,Unavailable,Asian Art,3001,4000,0.75025,RGB
39546,Bamboo after Wen Tong,Ke Jiusi,dated 1343,China,China,1300's,Asian Art,2190,3722,0.588393337,RGB
39547,"Bamboo, old tree, and rock",Wu Zhen,dated 1338,China,China,1300's,Asian Art,1138,2000,0.569,RGB
39548,Rocky Landscape with Pines,Zhang Xun,before 1346,China,China,1300's,Asian Art,1116,1861,0.599677593,RGB
39549,Traveling through Snow-Covered Mountains,Yao Yanqing (Tingmei),Unavailable,China,China,Unavailable,Asian Art,1358,2000,0.679,RGB
39550,The Simple Retreat,Wang Meng,ca. 1370,China,China,1300's,Asian Art,1972,3880,0.508247423,RGB
39551,Mandarin ducks and cotton rose hibiscus,Lü Ji,late 15th century,China,China,1500's,Asian Art,2181,4000,0.54525,RGB
39552,Remonstrating with the emperor,Liu Jun,late 15th–early 16th century,China,China,1500's,Asian Art,2997,4000,0.74925,RGB
39553,Drunken recluse beneath an old tree,Chen Zihe,early 16th century,China,China,1600's,Asian Art,2997,4000,0.74925,RGB
39556,Joint Landscape,Shen Zhou,ca. 1509 and 1546,China,China,1500's,Asian Art,1961,1092,1.795787546,RGB
39641,Ink Making,Unidentified artist,early 19th century,China,China,1900's,Asian Art,566,682,0.829912023,RGB
39651,Equestrian Portrait of a Noble,Bakhta,ca. 1775,"India (Rajasthan, Devgarh)",India,1700's,Asian Art,4000,2988,1.338688086,RGB
39654,Garden of the Inept Administrator,Wen Zhengming,1551,China,China,1500's,Asian Art,2986,2843,1.05029898,RGB
39667,The Scholar Fu Sheng Transmitting the Book of Documents,Du Jin,15th–mid-16th century,China,China,1500's,Asian Art,1500,2000,0.75,RGB
39668,"Old Trees, Level Distance",Guo Xi,ca. 1080,China,China,1000's,Asian Art,3508,1872,1.873931624,RGB
39669,Taima Mandala,Unavailable,14th century,Japan,Japan,1400's,Asian Art,3288,4000,0.822,RGB
39714,View of a Garden Villa,Yuan Jiang,18th century (?),China,China,1800's,Asian Art,4000,3143,1.272669424,RGB
39725,Three Girls on a Riverbank,Torii Kiyonaga,early 19th century,Japan,Japan,1900's,Asian Art,3304,3000,1.101333333,RGB
39764,Ink Play,Jin Nong,dated 1754,China,China,1700's,Asian Art,2932,3521,0.832717978,RGB
39767,Grooms and Foreign Horses,Jin Nong,17th–18th century,China,China,1700's,Asian Art,553,694,0.796829971,RGB
39810,Bird peddler,Unidentified artist,late 15th–early 16th century,China,China,1500's,Asian Art,1137,1861,0.610961848,RGB
39881,Amitabha and Kshitigarba,Unidentified artist,first half of the 14th century,Korea,Korea,1400's,Asian Art,2520,4000,0.63,RGB
39882,Amitabha triad,Unidentified artist,ca. 13th century,Korea,Korea,1300's,Asian Art,2021,4000,0.50525,RGB
39883,Kshitigarbha,Unidentified artist,first half of the 14th century,Korea,Korea,1400's,Asian Art,3001,4000,0.75025,RGB
39887,Brahma with Attendants and Musicians,Unidentified artist,late 16th century,Korea,Korea,1600's,Asian Art,3736,3658,1.021323127,RGB
39889,Portrait of the Great Master Seosan,Unidentified artist,late 17th–18th century,Korea,Korea,1700's,Asian Art,2767,4000,0.69175,RGB
39894,Maharana Amar Singh II with Ladies of the Zenana outside the Picture Hall at Rajnagar,Stipple Master,ca. 1707–8,"India (Udaipur, Rajasthan)",India,1700's,Asian Art,3200,4000,0.8,RGB
39901,Night-Shining White,Han Gan,ca. 750,China,China,Before 1000,Asian Art,2000,1501,1.332445037,RGB
39933,"Sketch of an ""Inviting Rain"" Mandala",Unavailable,12th century,Japan,Japan,1200's,Asian Art,1500,2000,0.75,RGB
39935,Palace Ladies Bathing Children,Unidentified artist,11th century,China,China,1100's,Asian Art,1866,1062,1.757062147,RGB
39936,Finches and bamboo,Emperor Huizong,early 12th century,China,China,1200's,Asian Art,3824,2064,1.852713178,RGB
39937,Fish at play,Zhao Kexiong,12th–late 13th century,China,China,1200's,Asian Art,3841,3458,1.110757663,RGB
39993,Crane in a bamboo grove,Unidentified artist,14th–early 15th century,China,China,1400's,Asian Art,1314,1941,0.676970634,RGB
40002,Landscape in the style of Fan Kuan,Unidentified artist,early 12th century,China,China,1200's,Asian Art,1241,1942,0.639031926,RGB
40003,Travelers in a Wintry Forest,Unidentified artist,early 12th century,China,China,1200's,Asian Art,4000,3001,1.332889037,RGB
40010,Monkey and Bee,Okamoto Toyohiko,19th century,Japan,Japan,1900's,Asian Art,1671,2958,0.564908722,RGB
40021,Snow Clearing: Landscape after Li Cheng,Wang Hui,dated 1669,China,China,1600's,Asian Art,999,1941,0.514683153,RGB
40053,Xiantang Estuary,Xia Gui,ca. 1200,China,China,1200's,Asian Art,3887,3779,1.028578989,RGB
40055,Emperor Xuanzong's Flight to Shu,Unidentified artist,mid-12th century,China,China,1200's,Asian Art,1961,1471,1.33310673,RGB
40057,Fisherman's Lodge At Mount Xisai,Li Jie,ca. 1170,China,China,1100's,Asian Art,4000,2470,1.619433198,RGB
40072,Beauty Writing a Letter (copy of a section of the Hikone Screen),Unavailable,17th–18th century,Japan,Japan,1700's,Asian Art,5184,3456,1.5,RGB
40080,Fragrant Snow at Broken Bridge,Wang Mian,14th century,China,China,1400's,Asian Art,2061,3876,0.531733746,RGB
40081,Wang Xizhi watching geese,Qian Xuan,ca. 1295,China,China,1200's,Asian Art,1500,2000,0.75,RGB
40086,Scholar viewing a waterfall,Ma Yuan,late 12th–early 13th century,China,China,1200's,Asian Art,3407,3000,1.135666667,RGB
40106,Buddhist Temples amid Autumn Mountains,Unidentified artist,14th century,China,China,1400's,Asian Art,1993,1149,1.734551784,RGB
40133,Orchids,Ma Lin,second quarter of the 13th century,China,China,1300's,Asian Art,3250,3811,0.852794542,RGB
40137,Mandala of the Bodhisattva Monju (Manjushri) of the Eight Syllables,Unavailable,13th century,Japan,Japan,1300's,Asian Art,3001,4000,0.75025,RGB
40278,Meeting between Yaoshan and Li Ao,Zhiweng,before 1256,China,China,1200's,Asian Art,1501,2000,0.7505,RGB
40282,Buddha Amitabha descending from his Pure Land,Unidentified artist,13th century,China,China,1300's,Asian Art,2657,4000,0.66425,RGB
40284,Narcissus,Zhao Mengjian,mid-13th century,China,China,1300's,Asian Art,4000,3001,1.332889037,RGB
40303,Six Horses,Unidentified artists,13th–14th century,China,China,1300's,Asian Art,3821,2472,1.545711974,RGB
40336,Shiraito Waterfall at Hakone,Utagawa Hiroshige,19th century,Japan,Japan,1900's,Asian Art,4000,2826,1.415428167,RGB
40337,Koyurugi Beach of Sagami Province,Utagawa Hiroshige,19th century,Japan,Japan,1900's,Asian Art,4000,2808,1.424501425,RGB
40338,Kannon Slope of the Kiso Highway,Utagawa Hiroshige,19th century,Japan,Japan,1900's,Asian Art,4000,2805,1.426024955,RGB
40339,Shibaura Bay of Musashi Province,Utagawa Hiroshige,19th century,Japan,Japan,1900's,Asian Art,2000,1396,1.432664756,RGB
40340,Mt. Nokogiri Seen from a Distance,Utagawa Hiroshige,19th century,Japan,Japan,1900's,Asian Art,2000,1651,1.211387038,RGB
40341,Honmoku Bay of Musashi Province,Utagawa Hiroshige,19th century,Japan,Japan,1900's,Asian Art,4000,3337,1.19868145,RGB
40351,Bellflowers in Basket,Ogata Kenzan,18th century,Japan,Japan,1800's,Asian Art,1755,1338,1.311659193,RGB
40352,Three Beauties Playing Musical Instruments,Utagawa Kuniyoshi,19th century,Japan,Japan,1900's,Asian Art,925,651,1.420890937,RGB
40353,Mynah Birds Attacking an Owl,Sesson Shūkei,probably 19th century,Japan,Japan,1900's,Asian Art,3834,3208,1.195137157,RGB
40354,Camellia by Water,Ogata Kenzan,dated 1741,Japan,Japan,1700's,Asian Art,1807,1437,1.257480863,RGB
40393,The Pleasures of Fishes,Zhou Dongqing,dated 1291,China,China,1200's,Asian Art,3868,2107,1.835785477,RGB
40418,Landscape with Palace,Unavailable,Unavailable,China,China,Unavailable,Asian Art,2811,4000,0.70275,RGB
40420,Lȕ Dongbin and the Spirit of the Peony,Unidentified artist,Unavailable,China,China,Unavailable,Asian Art,426,700,0.608571429,RGB
40427,Birds Pursued by an Eagle,Unavailable,late 17th century,Japan,Japan,1700's,Asian Art,329,546,0.602564103,RGB
40428,Examining the Hanging Picture,Unidentified artist,ca. 1650,Korea,Korea,1600's,Asian Art,500,710,0.704225352,RGB
40429,Pavilion by the Lake,Samoje,late 18th century,Korea,Korea,1800's,Asian Art,553,900,0.614444444,RGB
40430,The Wise Men and Scrolls,Unidentified artist,19th century,Korea,Korea,1900's,Asian Art,493,900,0.547777778,RGB
40431,Wise Men and Children,Unidentified artist,19th century,Korea,Korea,1900's,Asian Art,510,900,0.566666667,RGB
40432,Scholar in a Lakeside Pavilion,Samoje,late 18th century,Korea,Korea,1800's,Asian Art,543,900,0.603333333,RGB
