objectID,Title,ArtistName,TimePeriod,Region Detailed,Country,Century,Culture
51482,Immortals' Studio by Stream and Bamboo,Unidentified artist,18th century or later,China,China,1800's,Asian Art
51484,Landscapes in the Styles of Various Artists,Cao Jian,dated 1716,China,China,1700's,Asian Art
51488,Scholar and Attendant in Mountain Retreat,Unidentified artist,Unavailable,China,China,Unavailable,Asian Art
51495,Washing a Horse,Unidentified artist,Unavailable,China,China,Unavailable,Asian Art
51496,Flower Vendor,Unidentified artist,Unavailable,China,China,Unavailable,Asian Art
51499,Rabbit,Unidentified artist,Unavailable,China,China,Unavailable,Asian Art
51501,Water Buffalo,Unidentified artist,Unavailable,China,China,Unavailable,Asian Art
51504,Sage Floating on Lotus Leaf,Unidentified artist,Unavailable,China,China,Unavailable,Asian Art
51509,Women in Garden,Unidentified artist,Unavailable,China,China,Unavailable,Asian Art
51510,An Autumnal Grove,Unidentified artist,Unavailable,China,China,Unavailable,Asian Art
51511,At the Dressing Table,Unidentified artist,19th century,China,China,1900's,Asian Art
51513,Fawn at Play,Unidentified artist,Unavailable,China,China,Unavailable,Asian Art
51518,Procession of Arhats,Unidentified artist,Unavailable,China,China,Unavailable,Asian Art
51519,Ten Paintings of Luohans,Unidentified artist,Unavailable,China,China,Unavailable,Asian Art
51522,Wild Geese,Unidentified artist,Unavailable,China,China,Unavailable,Asian Art
51523,"Bird Near Water (from Album of Studies by Modern Artists, no. 62)",Unidentified artist,Unavailable,China,China,Unavailable,Asian Art
51526,The Five Rulers at the New Year's Reception,Unidentified artist,Unavailable,China,China,Unavailable,Asian Art
51532,Treatise on Painting,Unidentified artist,Unavailable,China,China,Unavailable,Asian Art
51537,Five Rulers at New Year's Reception,Unidentified artist,Unavailable,China,China,Unavailable,Asian Art
51540,An Emperor with Two Ladies,Unidentified artist,Unavailable,China,China,Unavailable,Asian Art
51543,Peony Flower and Leaves,Unidentified artist,Unavailable,China,China,Unavailable,Asian Art
51546,The Dragon,Chen Rong,Unavailable,China,China,Unavailable,Asian Art
51547,Travellers,Unidentified artist,Unavailable,China,China,Unavailable,Asian Art
51548,Merry Gatherings in the Magic Jar,Gong Kai,Unavailable,China,China,Unavailable,Asian Art
51550,Map of China,Unidentified artist,Unavailable,China,China,Unavailable,Asian Art
51555,The Thousand Buddha Grotto,Unidentified artist,dated 690–691,China,China,Before 1000,Asian Art
51556,Part of a Buddhistic Sutra,Unidentified artist,dated 797,China,China,Before 1000,Asian Art
51564,Sea and Sky at Sunrise,Unidentified artist,17th century,China,China,1700's,Asian Art
51567,Washing Horses in a River,Unidentified artist,dated 1309,China,China,1300's,Asian Art
51569,A Beauty,Unidentified artist,Unavailable,China,China,Unavailable,Asian Art
51572,A Secluded Fishing Village,Unidentified artist,Unavailable,China,China,Unavailable,Asian Art
51574,Three Rabbits,Unidentified artist,Unavailable,China,China,Unavailable,Asian Art
51575,Garden Estate,Unidentified artist,17th century,China,China,1700's,Asian Art
51580,Geese and Lotus Leaves,Unidentified artist,Unavailable,China,China,Unavailable,Asian Art
51581,One hundred portraits of Peking opera characters,Unidentified artist,late 19th–early 20th century,China,China,1900's,Asian Art
51582,Horse and Landscape,Unidentified artist,Unavailable,China,China,Unavailable,Asian Art
51585,Canonization scroll of Li Zhong,Unidentified artist,colophon dated 1641,China,China,1600's,Asian Art
51586,Landscape of Qin Palaces,Unidentified artist,Unavailable,China,China,Unavailable,Asian Art
51595,Conference of Six States in the Warring States Period (ca. 481–221 B.C.),Unidentified artist,Unavailable,China,China,Unavailable,Asian Art
51600,Two Birds and Bamboo Plant,Unidentified artist,Unavailable,China,China,Unavailable,Asian Art
51602,Landscape with Man on Horseback,Liu Yen,Unavailable,China,China,Unavailable,Asian Art
51604,Grasshopper on Rock,Wen Liang,15th century,China,China,1500's,Asian Art
51605,Seven Birds in Bamboo Tree Nest,Unidentified artist,Unavailable,China,China,Unavailable,Asian Art
51607,Landscape with Man Crossing Bridge,Fan Hong,Unavailable,China,China,Unavailable,Asian Art
51608,Landscape with Ox Carts on a Road,Li Xiying,Unavailable,China,China,Unavailable,Asian Art
51611,Two Ladies in Foreground of Landscape,Unidentified artist,Unavailable,China,China,Unavailable,Asian Art
51616,Hunter and Wild Geese,Unidentified artist,Unavailable,China,China,Unavailable,Asian Art
51619,"Birds, Insects and Flowers",Yi Zhai,19th century,China,China,1900's,Asian Art
51621,Eight landscapes,Lu Han,1699,China,China,1600's,Asian Art
51622,Procession,Unidentified artist,late 19th century,China,China,1900's,Asian Art
51649,Giraffe with Two Keepers,Unidentified artist,Unavailable,China,China,Unavailable,Asian Art
51653,Eight Buddhist Paintings,Unidentified artist,Unavailable,China,China,Unavailable,Asian Art
51654,Snow Plum,Unidentified artist,Unavailable,China,China,Unavailable,Asian Art
51655,Mynah on Reed,Fulan Taorên,Unavailable,China,China,Unavailable,Asian Art
51656,Lake Palaces,Unidentified artist,Unavailable,China,China,Unavailable,Asian Art
51668,Library Scene,Unidentified artist,10th century,China,China,1000's,Asian Art
51680,Tartar Officer with Blond Lady Playing Musical Instruments,Unidentified artist,19th century,China,China,1900's,Asian Art
51681,Tartar Officer Courting Blond Lady,Unidentified artist,Unavailable,China,China,Unavailable,Asian Art
51682,River Scene,Unidentified artist,Unavailable,China,China,Unavailable,Asian Art
51683,Landscape with Rapids,Unidentified artist,Unavailable,China,China,Unavailable,Asian Art
51684,Tartar Officer with Blond Lady,Unidentified artist,Unavailable,China,China,Unavailable,Asian Art
51686,Tartar Officer Carrying Blond Lady,Unidentified artist,19th century,China,China,1900's,Asian Art
51687,Mouse Eating Lichee Fruit,Unidentified artist,Unavailable,China,China,Unavailable,Asian Art
51691,Snow Landscape,Unidentified artist,Unavailable,China,China,Unavailable,Asian Art
51692,Daoist Riding Horned Animal,Tong Rênyi,Unavailable,China,China,Unavailable,Asian Art
51694,Crabs and Reeds,Unidentified artist,Unavailable,China,China,Unavailable,Asian Art
51698,Nine Dragons,Unidentified artist,17th century,China,China,1700's,Asian Art
51703,Flowers and Insects,Unidentified artist,Unavailable,China,China,Unavailable,Asian Art
51704,Portrait of a Member and Record of the Wang Family,Unidentified artist,Unavailable,China,China,Unavailable,Asian Art
51705,Horse and groom,Unidentified artist,16th century,China,China,1600's,Asian Art
51707,Varieties of Lychee Fruit,Unidentified artist,Unavailable,China,China,Unavailable,Asian Art
51708,Washing the Sacred Elephant,Unidentified artist,Unavailable,China,China,Unavailable,Asian Art
51711,Landscape with goats,Unidentified artist,Unavailable,China,China,Unavailable,Asian Art
51715,Collared Crows on Winter Prunus,Unidentified artist,Unavailable,China,China,Unavailable,Asian Art
51723,Happy Return from the West,Unidentified artist,Unavailable,China,China,Unavailable,Asian Art
51724,Bamboos,Unidentified artist,Unavailable,China,China,Unavailable,Asian Art
51726,Pavilion with Figures,Unidentified artist,Unavailable,China,China,Unavailable,Asian Art
51727,The Nine Songs: Illustrations to the poems of Qu Yuan (343–277 B.C.),Unidentified artist,Unavailable,China,China,Unavailable,Asian Art
51728,Two Ancestors of the Mao Family,Unidentified artist,Unavailable,China,China,Unavailable,Asian Art
51730,Landscape in the Tang Manner,Unidentified artist,Unavailable,China,China,Unavailable,Asian Art
51738,Mongol with Horse and Camel,Unidentified artist,Unavailable,China,China,Unavailable,Asian Art
51739,Birds on Fruit Branch,Unidentified artist,Unavailable,China,China,Unavailable,Asian Art
51741,Zhang Guolao and His Magic Mule,Yin Qi,Unavailable,China,China,Unavailable,Asian Art
51742,Lotus,Unidentified artist,Unavailable,China,China,Unavailable,Asian Art
51744,Emperor and Two Attendants,Unidentified artist,Unavailable,China,China,Unavailable,Asian Art
51745,Lady and Children,Unidentified artist,Unavailable,China,China,Unavailable,Asian Art
51747,Chinese Bulbuls on Flowering Cherry-Apple,Unidentified artist,Unavailable,China,China,Unavailable,Asian Art
51752,The Hundred Horses,Unidentified artist,Unavailable,China,China,Unavailable,Asian Art
51759,Crane,Unidentified artist,Unavailable,China,China,Unavailable,Asian Art
51762,Snow-covered Mountains,Xu Daoning,ca. 1000,China,China,1000's,Asian Art
51763,Cabbage and Insects,Xü Daoguang,Unavailable,China,China,Unavailable,Asian Art
51767,Spring Pictures,Unidentified artist,Unavailable,China,China,Unavailable,Asian Art
51768,The Hundred Flowers,Wang Yuan,Unavailable,China,China,Unavailable,Asian Art
51769,River Landscape in Autumn,Luo Mu,dated 1661,China,China,1600's,Asian Art
51771,Lady and Attendant,Unidentified artist,19th century,China,China,1900's,Asian Art
51773,Horses in Landscape with Attendant,Unidentified artist,Unavailable,China,China,Unavailable,Asian Art
51797,Figure Painting,Shen Zhenlin,mid-19th century,China,China,1900's,Asian Art
51798,Buddha Seated on Lotus Throne,Jiang Jun,Unavailable,China,China,Unavailable,Asian Art
51800,Poets Gathering in the Orchid Pavilion,Qian Gong,dated 1607,China,China,1600's,Asian Art
51803,,Bada Shanren (Zhu Da),Unavailable,China,China,Unavailable,Asian Art
51809,Twenty-four Paragons of Filial Piety,Unidentified artist,19th century,China,China,1900's,Asian Art
51817,Terrace Scene with Figures,Unidentified artist,17th century,China,China,1700's,Asian Art
51823,Collection of Paintings showing Military Officials,Unidentified artist,Unavailable,China,China,Unavailable,Asian Art
51838,Album Containing Twelve Paintings of Birds,Unidentified artist,19th century,China,China,1900's,Asian Art
51839,Album Containing Twelve Paintings of Insects,Unidentified artist,19th century,China,China,1900's,Asian Art
51842,Taoist Diety,Unidentified artist,Unavailable,China,China,Unavailable,Asian Art
51851,Album Containing Twelve Paintings of Scenes Along a River,Unidentified artist,19th century,China,China,1900's,Asian Art
51854,European Couple and Child Playing with Parrot,Unidentified artist,18th century,China,China,1800's,Asian Art
51858,Landscape with Autumn Foliage,Shen Zhou,Unavailable,China,China,Unavailable,Asian Art
51859,Scholar Contemplating Towering Rock,Unidentified artist,20th century,China,China,2000's,Asian Art
51863,Mountains and Pavilions,Unidentified artist,Unavailable,China,China,Unavailable,Asian Art
51864,Landscapes with Poems,Gong Xian,1688,China,China,1600's,Asian Art
51866,An Immortal on a Cloud with a Pair of Peaches,Unidentified artist,20th century,China,China,2000's,Asian Art
51871,The Daming Palace,Wang Zhenpeng,early 15th century,China,China,1500's,Asian Art
51896,Plants and Vegetables,Unidentified artist,dated 1740,China,China,1700's,Asian Art
51903,Album Containing Twelve Paintings of People Making Silk,Unidentified artist,19th century,China,China,1900's,Asian Art
52080,White Lotus Society,Unidentified artist,14th or 15th century,China,China,1400's,Asian Art
52705,Bodhisattva with Double Halo,Unidentified artist,late 18th–early 19th century,Korea,Korea,1800's,Asian Art
52988,"“Mount Utsu” (Utsu no yama), from The Tales of Ise (Ise monogatari)",Tawaraya Sōtatsu,ca. 1634,Japan,Japan,1600's,Asian Art
53010,Jizō Bosatsu Playing a Flute,Kano Tan'yū,mid- 17th century,Japan,Japan,1700's,Asian Art
53012,Eight Views from The Tale of Genji,Ishiyama Moroka,Unavailable,Japan,Japan,Unavailable,Asian Art
53163,Iconographical Drawing of the Mandala of the Wisdom King Aizen,Unavailable,Kashō 2 (1107),Japan,Japan,1100's,Asian Art
53164,"Daishōjin Bosatsu, from “Album of Buddhist Deities from the Diamond World and Womb World Mandalas”",Takuma Tametō,12th century,Japan,Japan,1200's,Asian Art
53179,"Shaka (Shakyamuni), the Historical Buddha, with Two Attendant Bodhisattvas and Sixteen Arhats",Unavailable,14th century,Japan,Japan,1400's,Asian Art
53180,"Satsubari, the Second of the Sixteen Arhats",Unavailable,late 14th century,Japan,Japan,1400's,Asian Art
53181,Scene from The Illustrated Legends of Jin’ōji Temple,Unavailable,early 14th century,Japan,Japan,1400's,Asian Art
53186,Mandala of Kasuga Shrine,Unavailable,early 14th century,Japan,Japan,1400's,Asian Art
53187,Deer Mandala of Kasuga Shrine,Unavailable,late 14th century,Japan,Japan,1400's,Asian Art
53188,"Courtiers Visit Sugawara no Michizane’s Mortuary Temple, from Illustrated Legends of the Kitano Tenjin Shrine",Unavailable,ca. 1300,Japan,Japan,1300's,Asian Art
53189,Seiryū Gongen,Unavailable,mid-14th century,Japan,Japan,1400's,Asian Art
53194,The Tale of Sumiyoshi,Unavailable,late 13th century,Japan,Japan,1300's,Asian Art
53195,"Battle at Rokuhara, from The Tale of the Heiji Rebellion",Unavailable,first quarter of the14th century,Japan,Japan,1400's,Asian Art
53198,Wagtail on a Rock,Taikyo Genju,mid-14th century,Japan,Japan,1400's,Asian Art
53199,"Orchids, Bamboo, Briars, and Rocks",Tesshū Tokusai,mid-14th century,Japan,Japan,1400's,Asian Art
53204,"The Poet Koōgimi, from the “Fujifusa Version” of Thirty-six Poetic Immortals (Fujifusa-bon Sanjūrokkasen emaki)l",Unavailable,15th century,Japan,Japan,1500's,Asian Art
53205,Mandala of the Bodhisattva Hannya (Prajnaparamita),Unavailable,14th century,Japan,Japan,1400's,Asian Art
53207,Geese and Reeds,Unavailable,late 14th century,Japan,Japan,1400's,Asian Art
53210,Ox and Herdsman,Unidentified artist,late 13th century,China,China,1300's,Asian Art
53212,Su Shi Riding a Donkey,Bokudō Sojun,early 15th century,Japan,Japan,1500's,Asian Art
53219,Cicada on a Grapevine,Bokurin Guan,late 14th century,Japan,Japan,1400's,Asian Art
53221,Birds and Flowers of Summer and Autumn,Shikibu Terutada,mid-16th century,Japan,Japan,1600's,Asian Art
53222,Musk Cat,Uto Gyoshi,mid–late 16th century,Japan,Japan,1600's,Asian Art
53226,Two Views from the Eight Views of the Xiao and Xiang Rivers,Kantei,early 16th century,Japan,Japan,1600's,Asian Art
53228,Splashed-Ink Landscape,Bokushō Shūshō,early 16th century,Japan,Japan,1600's,Asian Art
53230,Landscape with Rocky Precipice,Sesson Shūkei,16th century,Japan,Japan,1600's,Asian Art
53233,Bo Ya Plays the Qin as Zhong Ziqi Listens,Kano Motonobu,1530s,Japan,Japan,1500's,Asian Art
53237,Pheasants among Trees: Flowers of the Four Seasons,Kano Shōei,probably 1560s,Japan,Japan,1500's,Asian Art
53238,Zheng Huangniu and Yushanzhu,Kano Naizen,early 17th century,Japan,Japan,1700's,Asian Art
53245,"“A Lovely Garland” (Tamakazura), from The Tale of Genji",Tosa Mitsuyoshi 土佐光吉,early 17th century,Japan,Japan,1700's,Asian Art
53246,Two Poems from One Hundred Poems by One Hundred Poets,Hon'ami Kōetsu,ca. 1615–20,Japan,Japan,1600's,Asian Art
53408,White Plum Blossoms and Moon,Itō Jakuchū,1755,Japan,Japan,1700's,Asian Art
53409,Two Cranes,Itō Jakuchū,1795,Japan,Japan,1700's,Asian Art
53410,Lions at the Stone Bridge of Mount Tiantai,Soga Shōhaku,1779,Japan,Japan,1700's,Asian Art
53422,Hotei,Ogata Kōrin,after 1704,Japan,Japan,1700's,Asian Art
53424,Irises and Moth,Suzuki Kiitsu,ca. 1850,Japan,Japan,1800's,Asian Art
53441,Beauty of the Kanbun Era,Unavailable,late 17th century,Japan,Japan,1700's,Asian Art
53444,Courtesan Writing a Letter,Kaigetsudō Doshin,ca. 1715,Japan,Japan,1700's,Asian Art
53445,"The Auspicious Noh Dance ""Okina""",Toriyama Sekien,ca. 1790–95,Japan,Japan,1700's,Asian Art
53446,Woman in a Black Kimono,Katsukawa Shunshō　勝川春章,1783–89,Japan,Japan,1700's,Asian Art
53447,Courtesan and her Attendants under a Willow Tree,Unchō 雲潮,1796,Japan,Japan,1700's,Asian Art
53450,Window onto Bamboo on a Rainy Day,Gion Nankai,first half of the 18th century,Japan,Japan,1800's,Asian Art
53451,Snowy Landscape,Sakaki Hyakusen,1744,Japan,Japan,1700's,Asian Art
53453,Scene from The Narrow Road to the Deep North,Yosa Buson,ca. 1780,Japan,Japan,1700's,Asian Art
53454,Two Poems from the Collection of Ancient and Modern Poems (Kokin wakashū),Ike Taiga,1734,Japan,Japan,1700's,Asian Art
53457,Peony and Bamboo,Ike (Tokuyama) Gyokuran,ca. 1768,Japan,Japan,1700's,Asian Art
53460,"On a Rustic Bridge, Carrying a Zither",Urakami (Uragami) Gyokudō 浦上玉堂,1814,Japan,Japan,1800's,Asian Art
53462,Rainstorm over a River Village,Tanomura Chikuden,late 18th–early 19th century,Japan,Japan,1800's,Asian Art
53527,Portrait of Yongzheng Emperor (1723–1735),Unidentified artist,19th century,China,China,1900's,Asian Art
53528,Portrait of Yongzheng Empress (1723–1735),Unidentified artist,19th century,China,China,1900's,Asian Art
53531,Portrait of Qianlong Emperor As a Young Man,Unidentified artist,19th century,China,China,1900's,Asian Art
53533,Portrait of a Qianlong Empress,Unidentified artist,19th century,China,China,1900's,Asian Art
53543,Maharaja Sital Dev in Devotion,Unavailable,ca. 1690,"India (Punjab Hills, Basohli)",India,1600's,Asian Art
53549,Album,Unidentified artist,late 19th century,China,China,1900's,Asian Art
53551,"Interior with Woman, Child and Nurse",Unidentified artist,late 18th–early 19th century,China,China,1800's,Asian Art
53552,Roses and Wisteria,Unidentified artist,probably 18th–19th century,China,China,1800's,Asian Art
53568,Xi Wang Mu with Feng Wang,Jiang Feng,Unavailable,China,China,Unavailable,Asian Art
53572,Man and Woman on Horseback,Unidentified artist,Unavailable,China,China,Unavailable,Asian Art
53594,Eight Landscape Scenes and Calligraphy,Unidentified artist,19th century,China,China,1900's,Asian Art
53597,Album Containing Twelve Paintings of Flowers,Unidentified artist,19th century,China,China,1900's,Asian Art
53601,Landscape with Pavilion and Willows,Shen Zhou,Unavailable,China,China,Unavailable,Asian Art
53603,Landscape with Sailboats,Shen Zhou,Unavailable,China,China,Unavailable,Asian Art
53660,Ten Verses on Oxherding,Unavailable,1278,Japan,Japan,1200's,Asian Art
53824,Deutzia Crenata,Ōtagaki Rengetsu,Unavailable,Japan,Japan,Unavailable,Asian Art
54184,A Female Musician Charms an Antelope,Unavailable,ca. 1825,"Western India, Rajasthan, Kota",India,1800's,Asian Art
54199,Dakini,Unavailable,14th century,Japan,Japan,1400's,Asian Art
54464,Tai Kyokuden Temple in Kyoto; Built in 1895,Unavailable,ca. 1895–1900,Japan,Japan,1800's,Asian Art
54566,"Peacocks, Pine Tree, and Peonies",Lü Ji 呂紀,probably 19th century,Japan,Japan,1900's,Asian Art
54567,Kingfisher and Bamboo,Sesshū Tōyō 雪舟等楊,19th century,Japan,Japan,1900's,Asian Art
54576,Heron and Willow,Sesshū Tōyō 雪舟等楊,18th–19th century,Japan,Japan,1800's,Asian Art
54593,Bodhidharma (Daruma),Kano Sanraku 狩野山楽,17th century,Japan,Japan,1700's,Asian Art
54594,Sparrow and Bamboo,Kano Tan'yū,17th–18th century,Japan,Japan,1700's,Asian Art
54604,Eagle Attacking a Monkey,Kawanabe Kyōsai 河鍋暁斎,1885,Japan,Japan,1800's,Asian Art
54605,Eagle Attacking a Mountain Lion,Kawanabe Kyōsai 河鍋暁斎,1885,Japan,Japan,1800's,Asian Art
54606,White Eagle Eyeing a Mountain Lion,Kawanabe Kyōsai 河鍋暁斎,1885,Japan,Japan,1800's,Asian Art
54607,Eagle Pursuing Rabbit,Kawanabe Kyōsai 河鍋暁斎,1885,Japan,Japan,1800's,Asian Art
54609,Two Crows on a Pine Branch,Kawanabe Kyōsai 河鍋暁斎,ca. 1887,Japan,Japan,1800's,Asian Art
54610,Mount Fuji,Kawanabe Kyōsai 河鍋暁斎,ca. 1887,Japan,Japan,1800's,Asian Art
54611,Flock of Crows at Dawn,Kawanabe Kyōsai 河鍋暁斎,ca. 1887,Japan,Japan,1800's,Asian Art
54612,Eagle Attacking Fish,Kawanabe Kyōsai 河鍋暁斎,ca. 1887,Japan,Japan,1800's,Asian Art
54613,Swallows by a Waterfall,Kawanabe Kyōsai 河鍋暁斎,ca. 1887,Japan,Japan,1800's,Asian Art
54614,Crow and Reeds by a Stream,Kawanabe Kyōsai 河鍋暁斎,ca. 1887,Japan,Japan,1800's,Asian Art
54615,Two Birds on a Branch,Kawanabe Kyōsai 河鍋暁斎,ca. 1887,Japan,Japan,1800's,Asian Art
54616,Monkeys,Kawanabe Kyōsai 河鍋暁斎,March 1888,Japan,Japan,1800's,Asian Art
54617,Fish in a Whirlpool,Kawanabe Kyōsai 河鍋暁斎,ca. 1887,Japan,Japan,1800's,Asian Art
54618,Crow on a Bamboo Branch,Kawanabe Kyōsai 河鍋暁斎,ca. 1887,Japan,Japan,1800's,Asian Art
54619,Rocky Landscape,Kawanabe Kyōsai 河鍋暁斎,ca. 1887,Japan,Japan,1800's,Asian Art
54620,"Waterfall, Eagle and Monkey",Kawanabe Kyōsai 河鍋暁斎,ca. 1887,Japan,Japan,1800's,Asian Art
54621,Crow on a Branch,Kawanabe Kyōsai 河鍋暁斎,ca. 1887,Japan,Japan,1800's,Asian Art
54622,Rabbits,Kawanabe Kyōsai 河鍋暁斎,ca. 1887,Japan,Japan,1800's,Asian Art
54623,Pheasant Caught by a Snake,Kawanabe Kyōsai 河鍋暁斎,ca. 1887,Japan,Japan,1800's,Asian Art
54624,Two Children Playing with Goldfish,Kawanabe Kyōsai 河鍋暁斎,ca. 1887,Japan,Japan,1800's,Asian Art
54625,Singing Bird on a Branch,Kawanabe Kyōsai 河鍋暁斎,ca. 1887,Japan,Japan,1800's,Asian Art
54626,Cat Catching a Frog,Kawanabe Kyōsai 河鍋暁斎,ca. 1887,Japan,Japan,1800's,Asian Art
54627,Crow on a Rock,Kawanabe Kyōsai 河鍋暁斎,ca. 1887,Japan,Japan,1800's,Asian Art
54629,Rats and Gourd,Kawanabe Kyōsai 河鍋暁斎,ca. 1887,Japan,Japan,1800's,Asian Art
54630,Deer and Monkeys,Kawanabe Kyōsai 河鍋暁斎,ca. 1887,Japan,Japan,1800's,Asian Art
54631,Crow and the Moon,Kawanabe Kyōsai 河鍋暁斎,ca. 1887,Japan,Japan,1800's,Asian Art
54633,Squirrels Gathering Chestnuts,Kawanabe Kyōsai 河鍋暁斎,ca. 1887,Japan,Japan,1800's,Asian Art
54634,Monkey Hanging from Grapevines,Kawanabe Kyōsai 河鍋暁斎,ca. 1887,Japan,Japan,1800's,Asian Art
54635,Starlings on a Branch,Kawanabe Kyōsai 河鍋暁斎,ca. 1887,Japan,Japan,1800's,Asian Art
54636,Cranes in Marsh,Kawanabe Kyōsai 河鍋暁斎,ca. 1887,Japan,Japan,1800's,Asian Art
54637,Fox Catching Bird,Kawanabe Kyōsai 河鍋暁斎,ca. 1887,Japan,Japan,1800's,Asian Art
54638,Eagle Holding Small Bird,Kawanabe Kyōsai 河鍋暁斎,ca. 1887,Japan,Japan,1800's,Asian Art
54639,Owl Mocked by Small Birds,Kawanabe Kyōsai 河鍋暁斎,ca. 1887,Japan,Japan,1800's,Asian Art
54640,Crow Flying in the Snow,Kawanabe Kyōsai 河鍋暁斎,ca. 1887,Japan,Japan,1800's,Asian Art
54641,Bird and Frog,Kawanabe Kyōsai 河鍋暁斎,ca. 1887,Japan,Japan,1800's,Asian Art
54642,Crow and Willow Tree,Kawanabe Kyōsai 河鍋暁斎,November 1887,Japan,Japan,1800's,Asian Art
54643,Crayfish,Watanabe Seitei,ca. 1887,Japan,Japan,1800's,Asian Art
54644,Birds on a Flowering Branch,Watanabe Seitei,ca. 1887,Japan,Japan,1800's,Asian Art
54645,Sparrows Flying,Watanabe Seitei,ca. 1887,Japan,Japan,1800's,Asian Art
54672,Egrets in a Tree at Night,Watanabe Seitei,ca. 1887,Japan,Japan,1800's,Asian Art
54673,Bird on Branch Watching Spider,Watanabe Seitei,ca. 1887,Japan,Japan,1800's,Asian Art
54674,Duck,Watanabe Seitei,ca. 1887,Japan,Japan,1800's,Asian Art
54675,Bird Catching Fish Among Reeds,Watanabe Seitei,ca. 1887,Japan,Japan,1800's,Asian Art
54676,Pigeons in a Tree,Watanabe Seitei,ca. 1887,Japan,Japan,1800's,Asian Art
54677,Lake and Mountains,Hashimoto Gahō,ca. 1885–89,Japan,Japan,1800's,Asian Art
54684,Three Birds on Branch,Watanabe Seitei,ca. 1887,Japan,Japan,1800's,Asian Art
54686,Boy with Cow at the River's Edge,Hashimoto Gahō,Unavailable,Japan,Japan,Unavailable,Asian Art
54687,Rapids and Fall of a River,Hashimoto Gahō,Unavailable,Japan,Japan,Unavailable,Asian Art
54688,Shakyamuni Conquering the Demons (Shaka Gōma-zu),Kawanabe Kyōsai 河鍋暁斎,ca. 1888,Japan,Japan,1800's,Asian Art
54692,Egrets at the Water's Edge,Watanabe Seitei,ca. 1887,Japan,Japan,1800's,Asian Art
54694,"Roses, Young Bird and a Butterfly",Watanabe Seitei,ca. 1887,Japan,Japan,1800's,Asian Art
54695,Rooster and Hen with Chicks,Watanabe Seitei,ca. 1887,Japan,Japan,1800's,Asian Art
54698,Birds on a Branch,Watanabe Seitei,ca. 1887,Japan,Japan,1800's,Asian Art
54699,Ducks in the Rushes,Watanabe Seitei,ca. 1887,Japan,Japan,1800's,Asian Art
54700,Flying Goose,Watanabe Seitei,ca. 1887,Japan,Japan,1800's,Asian Art
54701,Lake and Causeway,Hashimoto Gahō,ca. 1885–89,Japan,Japan,1800's,Asian Art
54703,Eagle in a Tree,Watanabe Seitei,ca. 1887,Japan,Japan,1800's,Asian Art
54704,Ducks and Reeds,Kano Tan'yū,ca. 1650,Japan,Japan,1600's,Asian Art
54706,Bird on a Plum Tree,Kano Naonobu,Unavailable,Japan,Japan,Unavailable,Asian Art
54707,Squirrel on Bamboo,Kano Tan'yū,ca. 1650,Japan,Japan,1600's,Asian Art
54708,Blossoms by a River,Kawabata Gyokushō,1800,Japan,Japan,1800's,Asian Art
54709,Traveling by Moonlight,Kawabata Gyokushō,1800,Japan,Japan,1800's,Asian Art
54711,River Scene with Rocky Hills in Background,Kawabata Gyokushō,1868,Japan,Japan,1800's,Asian Art
54712,Cotton Rose Mallows in the Rain,Okada Baison,ca. 1891–92,Japan,Japan,1800's,Asian Art
54714,Fishes Swimming,Seki Shūkō,"Summer, 1891",Japan,Japan,1800's,Asian Art
54732,Hawk Holding a Small Bird,Okada Baison,ca. 1891–92,Japan,Japan,1800's,Asian Art
54733,A Swallow in the Rain,Okada Baison,ca. 1891–92,Japan,Japan,1800's,Asian Art
54734,School of Fishes,Seki Shūkō,ca. 1890–92,Japan,Japan,1800's,Asian Art
54735,Jumping fish,Watanabe Seitei,ca. 1887,Japan,Japan,1800's,Asian Art
54736,Fishes,Watanabe Seitei,ca. 1887,Japan,Japan,1800's,Asian Art
54737,Visiting a Friend,Seki Shūkō,1892,Japan,Japan,1800's,Asian Art
54738,Winter Scene,Seki Shūkō,1892,Japan,Japan,1800's,Asian Art
54739,Goldfish,Watanabe Seitei,ca. 1887,Japan,Japan,1800's,Asian Art
54740,Carp swimming,Watanabe Seitei,ca. 1887,Japan,Japan,1800's,Asian Art
54741,Bottom of the Sea Showing Cray Fish,Seki Shūkō,ca. 1890–92,Japan,Japan,1800's,Asian Art
