objectID,Title,ArtistName,TimePeriod,Region Detailed,Country,Century,Culture
436037,The Judgment of Paris,Lucas Cranach the Elder,ca. 1528,German,Germany,1500's,European Paintings
436038,Judith with the Head of Holofernes,Lucas Cranach the Elder,ca. 1530,German,Germany,1500's,European Paintings
436039,The Martyrdom of Saint Barbara,Lucas Cranach the Elder,ca. 1510,German,Germany,1500's,European Paintings
436040,Portrait of a Man with a Rosary,Lucas Cranach the Elder,ca. 1508,German,Germany,1500's,European Paintings
436041,Samson and Delilah,Lucas Cranach the Elder,ca. 1528–30,German,Germany,1500's,European Paintings
436042,Venus and Cupid,Lucas Cranach the Elder,ca. 1525–27,German,Germany,1500's,European Paintings
436043,"Friedrich III (1463–1525), the Wise, Elector of Saxony",Lucas Cranach the Elder and Workshop,1533,German,Germany,1500's,European Paintings
436045,"Johann I (1468–1532), the Constant, Elector of Saxony",Lucas Cranach the Elder and Workshop,1532–33,German,Germany,1500's,European Paintings
436047,Martin Luther (1483–1546),Lucas Cranach the Elder,probably 1532,German,Germany,1500's,European Paintings
436048,The Meeting of Alexander the Great and Diogenes,Gaspar de Crayer,Unavailable,Flemish,Belgium,Unavailable,European Paintings
436049,Philip IV (1605–1665) in Parade Armor,Gaspar de Crayer,ca. 1628,Flemish,Belgium,1600's,European Paintings
436050,Saint Lucy and Her Mother at the Shrine of Saint Agatha; Saint Lucy Giving Alms; Saint Lucy before Paschasius; Saint Lucy Resisting Efforts to Move Her,Giovanni di Bartolommeo Cristiani,Unavailable,Italian,Italy,Unavailable,European Paintings
436053,Pietà,Carlo Crivelli,1476,Italian,Italy,1400's,European Paintings
436054,Saint Dominic,Carlo Crivelli,1472,Italian,Italy,1400's,European Paintings
436057,"Hautbois Common, Norfolk",John Crome,probably ca. 1810,British,Britain,1800's,European Paintings
436060,Bacchus and Nymphs in a Landscape,Abraham van Cuylenborch,probably 1640s,Dutch,Netherlands,1600's,European Paintings
436061,Landscape with the Flight into Egypt,Aelbert Cuyp,ca. 1650,Dutch,Netherlands,1600's,European Paintings
436062,Piping Shepherds,Aelbert Cuyp,ca. 1643–44,Dutch,Netherlands,1600's,European Paintings
436063,Equestrian Portrait of Cornelis (1639–1680) and Michiel Pompe van Meerdervoort (1638–1653) with Their Tutor and Coachman,Aelbert Cuyp,ca. 1652–53,Dutch,Netherlands,1600's,European Paintings
436064,Young Herdsmen with Cows,Aelbert Cuyp,ca. 1655–60,Dutch,Netherlands,1600's,European Paintings
436065,Children and a Cow,Aelbert Cuyp,1635–39,Dutch,Netherlands,1600's,European Paintings
436068,Christ Enthroned with Saints,Bernardo Daddi,ca. 1325,Italian,Italy,1300's,European Paintings
436069,Saint Reparata before the Emperor Decius,Bernardo Daddi,ca. 1338–40,Italian,Italy,1300's,European Paintings
436070,Saint Reparata Being Prepared for Execution,Bernardo Daddi,Unavailable,Italian,Italy,Unavailable,European Paintings
436071,Saint Reparata Tortured with Red-Hot Irons,Bernardo Daddi,Unavailable,Italian,Italy,Unavailable,European Paintings
436073,Madonna and Child Enthroned with Saints,Bernardo Daddi,Unavailable,Italian,Italy,Unavailable,European Paintings
436078,Charity,Cesare Dandini,ca. 1630,Italian,Italy,1600's,European Paintings
436079,Uvedale Tomkyns Price (1685–1764) and Members of His Family,Bartholomew Dandridge,possibly early 1730s,British,Britain,1700's,European Paintings
436080,The Banks of the Oise,Charles-François Daubigny,1863,French,France,1800's,European Paintings
436081,Landscape on a River,Charles-François Daubigny,1863,French,France,1800's,European Paintings
436083,A River Landscape with Storks,Charles-François Daubigny,1864,French,France,1800's,European Paintings
436084,Boats on the Seacoast at Étaples,Charles-François Daubigny,1871,French,France,1800's,European Paintings
436085,Apple Blossoms,Charles-François Daubigny,1873,French,France,1800's,European Paintings
436086,The Seine: Morning,Charles-François Daubigny,1874,French,France,1800's,European Paintings
436088,Portejoie on the Seine,Charles-François Daubigny,1858 or 1868,French,France,1800's,European Paintings
436089,The Hamlet of Optevoz,Charles-François Daubigny,ca. 1852,French,France,1800's,European Paintings
436091,The Laundress,Honoré Daumier,186[3?],French,France,1800's,European Paintings
436092,Don Quixote and the Dead Mule,Honoré Daumier,after 1864,French,France,1800's,European Paintings
436093,The Drinkers,Honoré Daumier,by 1861,French,France,1800's,European Paintings
436095,The Third-Class Carriage,Honoré Daumier,ca. 1862–64,French,France,1800's,European Paintings
436099,The Nativity with Donors and Saints Jerome and Leonard,Gerard David,ca. 1510–15,Netherlandish,Netherlands,1500's,European Paintings
436101,The Rest on the Flight into Egypt,Gerard David,ca. 1512–15,Netherlandish,Netherlands,1500's,European Paintings
436102,Virgin and Child with Four Angels,Gerard David,ca. 1510–15,Netherlandish,Netherlands,1500's,European Paintings
436105,The Death of Socrates,Jacques Louis David,1787,French,France,1700's,European Paintings
436106,"Antoine Laurent Lavoisier (1743–1794) and Marie Anne Lavoisier (Marie Anne Pierrette Paulze, 1758–1836)",Jacques Louis David,1788,French,France,1700's,European Paintings
436107,General Étienne-Maurice Gérard (1773–1852),Jacques Louis David,1816,French,France,1800's,European Paintings
436108,Head of a Child,Jacques Louis David,Unavailable,French,France,Unavailable,European Paintings
436114,The Experts,Alexandre-Gabriel Decamps,1837,French,France,1800's,European Paintings
436115,The Good Samaritan,Alexandre-Gabriel Decamps,by 1853,French,France,1800's,European Paintings
436116,The Turkish Patrol,Alexandre-Gabriel Decamps,Unavailable,French,France,Unavailable,European Paintings
436118,The Forge,Léonard Defrance,Unavailable,Flemish,Belgium,Unavailable,European Paintings
436119,The Rope Dance,Léonard Defrance,Unavailable,Flemish,Belgium,Unavailable,European Paintings
436120,The Old Italian Woman,Edgar Degas,1857,French,France,1800's,European Paintings
436121,A Woman Seated beside a Vase of Flowers (Madame Paul Valpinçon?),Edgar Degas,1865,French,France,1800's,European Paintings
436122,The Collector of Prints,Edgar Degas,1866,French,France,1800's,European Paintings
436123,"The Ballet from ""Robert le Diable""",Edgar Degas,1871,French,France,1800's,European Paintings
436139,Dancers Practicing at the Barre,Edgar Degas,1877,French,France,1800's,European Paintings
436140,"Dancers, Pink and Green",Edgar Degas,ca. 1890,French,France,1800's,European Paintings
436141,The Dancing Class,Edgar Degas,ca. 1870,French,France,1800's,European Paintings
436144,James-Jacques-Joseph Tissot (1836–1902),Edgar Degas,ca. 1867–68,French,France,1800's,European Paintings
436145,Joseph-Henri Altès (1826–1895),Edgar Degas,1868,French,France,1800's,European Paintings
436149,"Madame Théodore Gobillard (Yves Morisot, 1838–1893)",Edgar Degas,1869,French,France,1800's,European Paintings
436150,Marie Dihau (1843–1935),Edgar Degas,1867–68,French,France,1800's,European Paintings
436152,Portrait of a Woman in Gray,Edgar Degas,ca. 1865,French,France,1800's,European Paintings
436162,Sulking,Edgar Degas,ca. 1870,French,France,1800's,European Paintings
436168,Two Men,Edgar Degas,ca. 1865–69,French,France,1800's,European Paintings
436174,A Woman Ironing,Edgar Degas,1873,French,France,1800's,European Paintings
436175,Basket of Flowers,Eugène Delacroix,1848–49,French,France,1800's,European Paintings
436176,Christ Asleep during the Tempest,Eugène Delacroix,ca. 1853,French,France,1800's,European Paintings
436177,George Sand's Garden at Nohant,Eugène Delacroix,ca. 1842–43,French,France,1800's,European Paintings
436178,Hamlet and His Mother,Eugène Delacroix,1849,French,France,1800's,European Paintings
436179,"Madame Henri François Riesener (Félicité Longrois, 1786–1847)",Eugène Delacroix,1835,French,France,1800's,European Paintings
436180,The Natchez,Eugène Delacroix,1823–24 and 1835,French,France,1800's,European Paintings
436182,Triumph of the Amazons,Claude Déruet,1620s,French,France,1600's,European Paintings
436183,Departure of the Amazons,Claude Déruet,1620s,French,France,1600's,European Paintings
436186,Still Life with Silver,Alexandre François Desportes,Unavailable,French,France,Unavailable,European Paintings
436187,A Dragoon on Horseback,Edouard Detaille,1876,French,France,1800's,European Paintings
436188,The Defense of Champigny,Edouard Detaille,1879,French,France,1800's,European Paintings
436189,Gendarmes d'Ordonnance,Edouard Detaille,1894,French,France,1800's,European Paintings
436190,Louis-Félix Amiel (1802–1864),Eugène Devéria,1837,French,France,1800's,European Paintings
436191,Diana,Narcisse-Virgile Diaz de la Peña,1849,French,France,1800's,European Paintings
436192,Autumn: The Woodland Pond,Narcisse-Virgile Diaz de la Peña,1867,French,France,1800's,European Paintings
436193,The Edge of the Woods,Narcisse-Virgile Diaz de la Peña,1872,French,France,1800's,European Paintings
436195,A Vista through Trees: Fontainebleau,Narcisse-Virgile Diaz de la Peña,1873,French,France,1800's,European Paintings
436196,The Forest of Fontainebleau,Narcisse-Virgile Diaz de la Peña,1874,French,France,1800's,European Paintings
436198,Saint Cecilia,Abraham van Diepenbeeck,Unavailable,Flemish,Belgium,Unavailable,European Paintings
436199,Christ Healing the Sick,Christian Wilhelm Ernst Dietrich,1742,German,Germany,1700's,European Paintings
436201,"Surprised, or Infidelity Found Out",Christian Wilhelm Ernst Dietrich,Unavailable,German,Germany,Unavailable,European Paintings
436205,Landscape with Moses and the Burning Bush,Domenichino (Domenico Zampieri),1610–16,Italian,Italy,1600's,European Paintings
436206,Portrait of an Old Man,Francisco Domingo y Marqués,1882,Spanish,Spain,1800's,European Paintings
436207,Don Quixote and Sancho Panza Entertained by Basil and Quiteria,Gustave Doré,1863?,French,France,1800's,European Paintings
436208,The Three Ages of Humans,Dosso Dossi (Giovanni de Lutero),Unavailable,Italian,Italy,Unavailable,European Paintings
436209,An Evening School,Gerrit Dou,ca. 1655–57,Dutch,Netherlands,1600's,European Paintings
436211,Portrait of a Man (Self-Portrait?),Willem Drost,1653 or 1655,Dutch,Netherlands,1600's,European Paintings
436212,Young Woman with a Pearl Necklace,Willem Drost,Unavailable,Dutch,Netherlands,Unavailable,European Paintings
436213,"Portrait of a Woman, Said to be Madame Charles Simon Favart (Marie Justine Benoîte Duronceray, 1727–1772)",François Hubert Drouais,1757,French,France,1700's,European Paintings
436214,"Marie Rinteau, called Mademoiselle de Verrières",François Hubert Drouais,1761,French,France,1700's,European Paintings
436215,Madame Sophie de France (1734–1782),François Hubert Drouais,1762,French,France,1700's,European Paintings
436216,Portrait of a Young Woman as a Vestal Virgin,François Hubert Drouais,1767,French,France,1700's,European Paintings
436217,Boy with a Black Spaniel,François Hubert Drouais,ca. 1767,French,France,1700's,European Paintings
436221,A Couple in an Interior with a Gypsy Fortune-Teller,Jacob Duck,ca. 1632–33,Dutch,Netherlands,1600's,European Paintings
436222,Self-Portrait with a Harp,Rose Adélaïde Ducreux,1791,French,France,1700's,European Paintings
436223,Landing the Shore End of the Atlantic Cable,Robert Charles Dudley,1866,British,Britain,1800's,European Paintings
436224,Awaiting the Reply,Robert Charles Dudley,ca. 1866,British,Britain,1800's,European Paintings
436225,Grappling for the Lost Cable,Robert Charles Dudley,ca. 1866,British,Britain,1800's,European Paintings
436226,"Homeward Bound: ""The Great Eastern""",Robert Charles Dudley,ca. 1866,British,Britain,1800's,European Paintings
436227,Landing at Newfoundland,Robert Charles Dudley,ca. 1866,British,Britain,1800's,European Paintings
436228,Making the Splice between the Shore End and the Ocean Cable,Robert Charles Dudley,ca. 1866,British,Britain,1800's,European Paintings
436229,Imaginary Landscape,Gaspard Dughet,Unavailable,French,France,Unavailable,European Paintings
436230,Card Players in a Drawing Room,Pierre Louis Dumesnil the Younger,Unavailable,French,France,Unavailable,European Paintings
436235,"Madame de Saint-Morys (Eléonore Elisabeth Angélique de Beauterne, 1742–1824)",Joseph Siffred Duplessis,1776,French,France,1700's,European Paintings
436236,Benjamin Franklin (1706–1790),Joseph Siffred Duplessis,1778,French,France,1700's,European Paintings
436239,"Anne Elizabeth Cholmley (1769–1788), Later Lady Mulgrave",Gainsborough Dupont,Unavailable,British,Britain,Unavailable,European Paintings
436240,Mrs. John Puget (Catherine Hawkins),Richard Gainsborough Dupont,Unavailable,British,Britain,Unavailable,European Paintings
436241,Cows Crossing a Ford,Jules Dupré,1836,French,France,1800's,European Paintings
436243,Salvator Mundi,Albrecht Dürer,ca. 1505,German,Germany,1500's,European Paintings
436244,Virgin and Child with Saint Anne,Albrecht Dürer,probably 1519,German,Germany,1500's,European Paintings
436246,Portrait of an Italian Woman,German Painter,Unavailable,German,Germany,Unavailable,European Paintings
436248,A Young Woman in a Landscape,Dutch Painter,Unavailable,Dutch,Netherlands,Unavailable,European Paintings
436252,"James Stuart (1612–1655), Duke of Richmond and Lennox",Anthony van Dyck,ca. 1633–35,Flemish,Belgium,1600's,European Paintings
436253,Lucas van Uffel (died 1637),Anthony van Dyck,ca. 1622,Flemish,Belgium,1600's,European Paintings
436255,"Portrait of a Woman, Called the Marchesa Durazzo",Anthony van Dyck,probably ca. 1622–25,Flemish,Belgium,1600's,European Paintings
436256,"Robert Rich (1587–1658), Second Earl of Warwick",Anthony van Dyck,ca. 1632–35,Flemish,Belgium,1600's,European Paintings
436257,Saint Rosalie Interceding for the Plague-stricken of Palermo,Anthony van Dyck,1624,Flemish,Belgium,1600's,European Paintings
436260,Study Head of an Old Man with a White Beard,Anthony van Dyck,ca. 1617–20,Flemish,Belgium,1600's,European Paintings
436262,Virgin and Child with Saint Catherine of Alexandria,Anthony van Dyck,ca. 1630,Flemish,Belgium,1600's,European Paintings
436266,Isaac Blessing Jacob,Gerbrand van den Eeckhout,1642,Dutch,Netherlands,1600's,European Paintings
436267,A Musical Party,Gerbrand van den Eeckhout,early 1650s,Dutch,Netherlands,1600's,European Paintings
436268,Putti with a Medallion,Charles Dominique Joseph Eisen,Unavailable,French,France,Unavailable,European Paintings
436270,Conversation Piece (The Sense of Smell),Jan Ekels the Younger,probably 1791,Dutch,Netherlands,1700's,European Paintings
436271,The Crucifixion with Donors and Saints Peter and Margaret,Cornelis Engebrechtsz,ca. 1525–27,Netherlandish,Netherlands,1500's,European Paintings
436278,Allegory,William Etty,Unavailable,British,Britain,Unavailable,European Paintings
436279,The Three Graces,William Etty,Unavailable,British,Britain,Unavailable,European Paintings
436283,Virgin and Child in a Niche,Netherlandish Painter,ca. 1500,Netherlandish,Netherlands,1500's,European Paintings
436284,A Donor Presented by a Saint,Dieric Bouts,ca. 1460–65,Netherlandish,Netherlands,1400's,European Paintings
436286,Portrait of a Man with a Moor's Head on His Signet Ring,Conrad Faber von Creuznach,Unavailable,German,Germany,Unavailable,European Paintings
436287,Heinrich(?) vom Rhein zum Mohren (1477–1536),Conrad Faber von Creuznach,late 1520s,German,Germany,1500's,European Paintings
436288,Abraham Dismissing Hagar and Ishmael,Barent Fabritius,1658,Dutch,Netherlands,1600's,European Paintings
436290,Flowers by a Stone Vase,Peter Faes,1786,Flemish,Belgium,1700's,European Paintings
436291,Flowers in a Stone Vase,Peter Faes,1786,Flemish,Belgium,1700's,European Paintings
436292,Still Life with Roses and Fruit,Henri Fantin-Latour,1863,French,France,1800's,European Paintings
436293,Still Life with Flowers and Fruit,Henri Fantin-Latour,1866,French,France,1800's,European Paintings
436294,Still Life with Pansies,Henri Fantin-Latour,1874,French,France,1800's,European Paintings
436296,The Palace of Aurora,Henri Fantin-Latour,1902,French,France,1900's,European Paintings
436299,"The Coronation of the Virgin, and Saints",Giovanni di Tano Fei,1394,Italian,Italy,1300's,European Paintings
436301,The Parable of the Mote and the Beam,Domenico Fetti,ca. 1619,Italian,Italy,1600's,European Paintings
436305,Still Life,Georg Flegel,probably ca. 1625–30,German,Germany,1600's,European Paintings
436309,Bearded Man with a Velvet Cap,Govert Flinck,1645,Dutch,Netherlands,1600's,European Paintings
436310,Portrait of a Prelate,Lavinia Fontana,ca. 1580,unavailable,Unknown,1500's,European Paintings
436318,Mirope Savati Gaye,Mariano Fortuny Marsal,1865,Spanish,Spain,1800's,European Paintings
436319,The Cascade,Jean Honoré Fragonard,ca. 1775,French,France,1700's,European Paintings
436321,Roman Interior,Jean Honoré Fragonard,ca. 1760,French,France,1700's,European Paintings
436322,The Love Letter,Jean Honoré Fragonard,early 1770s,French,France,1700's,European Paintings
436324,A Shaded Avenue,Jean Honoré Fragonard,ca. 1775,French,France,1700's,European Paintings
436325,The Stolen Kiss,Jean Honoré Fragonard,ca. 1760,French,France,1700's,European Paintings
436326,The Two Sisters,Jean Honoré Fragonard,ca. 1769–70,French,France,1700's,European Paintings
436327,Allegory of Vigilance,Jean Honoré Fragonard,ca. 1772,French,France,1700's,European Paintings
436329,Gathering Olives at Tivoli,François-Louis Français,1868,French,France,1800's,European Paintings
436332,Saint Roch,Francesco Francia,1502,Italian,Italy,1500's,European Paintings
436333,Federico Gonzaga (1500–1540),Francesco Francia,1510,Italian,Italy,1500's,European Paintings
436335,Madonna and Child with Saints Francis and Jerome,Francesco Francia,1500–10,Italian,Italy,1500's,European Paintings
436337,Portrait of a Monk in Prayer,French Painter,Unavailable,French,France,Unavailable,European Paintings
436338,Monsieur de Bellefourière,French Painter,Unavailable,French,France,Unavailable,European Paintings
436339,Portrait of a Member of the de Thou Family,French Painter,Unavailable,French,France,Unavailable,European Paintings
436340,Portrait of a Man with a High Hat,French Painter,Unavailable,French,France,Unavailable,European Paintings
436341,Portrait of a Man in a White Fur Coat,French Painter,Unavailable,French,France,Unavailable,European Paintings
436342,"Henri III (1551–1589), King of France",French Painter,Unavailable,French,France,Unavailable,European Paintings
436344,Holy Family with Saint Anne,French Painter,early 17th century,French,France,1700's,European Paintings
436345,Still Life with Strawberries,French Painter,Unavailable,French,France,Unavailable,European Paintings
436346,The Restoration of the Catholic Religion in Strasbourg,Claude Guy Hallé,ca. 1681,unavailable,Unknown,1600's,European Paintings
436347,Trompe l'oeil with Palettes and Miniature,Jean François de Le Motte,Unavailable,unavailable,Unknown,Unavailable,European Paintings
436397,Portrait of a Man in a Brown Coat,French Painter,Unavailable,French,France,Unavailable,European Paintings
436398,Portrait of a Woman in a Rose Dress,French Painter,Unavailable,French,France,Unavailable,European Paintings
436404,Portrait of a Woman Holding a Book,French Painter,Unavailable,French,France,Unavailable,European Paintings
436407,Portrait of a Man in a Blue Coat,French Painter,Unavailable,French,France,Unavailable,European Paintings
436408,Napoleon Bonaparte (1769–1821),French Painter,Unavailable,French,France,Unavailable,European Paintings
436410,The Nymph of Fontainebleau,French (Fontainebleau) Painter,Unavailable,French,France,Unavailable,European Paintings
436413,Christ Bearing the Cross,Northern French Painter,Unavailable,French,France,Unavailable,European Paintings
436415,Portrait of a Man of the Moncheaux Family,Northern French Painter,Unavailable,French,France,Unavailable,European Paintings
436416,The Resurrection,Spanish (Aragonese) Painter,Unavailable,Spanish,Spain,Unavailable,European Paintings
436418,Jerusalem from the Mount of Olives,Charles-Théodore Frère,by 1880,French,France,1800's,European Paintings
436419,The Arab Falconer,Eugène Fromentin,1864,French,France,1800's,European Paintings
436420,Arabs Crossing a Ford,Eugène Fromentin,1873,French,France,1800's,European Paintings
436423,The Night-Hag Visiting Lapland Witches,Henry Fuseli,1796,Swiss,Switzerland,1700's,European Paintings
436424,A Basket and Birds,Jan Fyt,Unavailable,Flemish,Belgium,Unavailable,European Paintings
436425,A Hare and Birds,Jan Fyt,Unavailable,Flemish,Belgium,Unavailable,European Paintings
436426,"A Hare, Partridges, and Fruit",Jan Fyt,Unavailable,Flemish,Belgium,Unavailable,European Paintings
436427,A Partridge and Small Game Birds,Jan Fyt,1650s,Flemish,Belgium,1600's,European Paintings
436428,The Trinity,Agnolo Gaddi,ca. 1390–96,Italian,Italy,1300's,European Paintings
436429,Saint Margaret and the Dragon,Agnolo Gaddi,ca. 1390,Italian,Italy,1300's,European Paintings
436431,Charles Rousseau Burney (1747–1819),Thomas Gainsborough,ca. 1780,British,Britain,1700's,European Paintings
436432,Queen Charlotte,Thomas Gainsborough,Unavailable,British,Britain,Unavailable,European Paintings
436433,A Boy with a Cat—Morning,Thomas Gainsborough,1787,British,Britain,1700's,European Paintings
436434,Lieutenant Colonel Paul Pechell (1724–1800),Thomas Gainsborough,Unavailable,British,Britain,Unavailable,European Paintings
436435,Mrs. Grace Dalrymple Elliott (1754?–1823),Thomas Gainsborough,1778,British,Britain,1700's,European Paintings
436436,"Mrs. Ralph Izard (Alice De Lancey, 1746/47–1832)",Thomas Gainsborough,Unavailable,British,Britain,Unavailable,European Paintings
436438,"John Hobart (1723–1793), 2nd Earl of Buckinghamshire",Thomas Gainsborough,Unavailable,British,Britain,Unavailable,European Paintings
436439,"Portrait of a Young Woman, Called Miss Sparrow",Thomas Gainsborough,1770s,British,Britain,1700's,European Paintings
436440,Cottage Children (The Wood Gatherers),Thomas Gainsborough,1787,British,Britain,1700's,European Paintings
436441,Wooded Upland Landscape,Thomas Gainsborough,probably 1783,British,Britain,1700's,European Paintings
436442,The Painter's Daughter Mary (1750–1826),Thomas Gainsborough,mid-19th century,British,Britain,1900's,European Paintings
436443,Saint Nicholas of Tolentino Reviving the Birds,Garofalo (Benvenuto Tisi da Garofalo),ca. 1530,Italian,Italy,1500's,European Paintings
436444,Saint Nicholas of Tolentino Reviving a Child,Garofalo (Benvenuto Tisi da Garofalo),ca. 1530,Italian,Italy,1500's,European Paintings
436445,The Translation of the Holy House of Loreto,Saturnino Gatti,ca. 1490,Italian,Italy,1400's,European Paintings
436446,Two Tahitian Women,Paul Gauguin,1899,French,France,1800's,European Paintings
436448,A Farm in Brittany,Paul Gauguin,ca. 1894,French,France,1800's,European Paintings
436449,The Siesta,Paul Gauguin,ca. 1892–94,French,France,1800's,European Paintings
436451,Tahitian Landscape,Paul Gauguin,1892,French,France,1800's,European Paintings
436453,Esther before Ahasuerus,Artemisia Gentileschi,Unavailable,Italian,Italy,Unavailable,European Paintings
436454,Alfred Dedreux (1810–1860) as a Child,Théodore Gericault,ca. 1819–20,French,France,1800's,European Paintings
436455,Evening: Landscape with an Aqueduct,Théodore Gericault,1818,French,France,1800's,European Paintings
436456,An Episode from the Life of Saint Giovanni Gualberto,Niccolò di Pietro Gerini,Unavailable,Italian,Italy,Unavailable,European Paintings
436472,Portrait of a Man in Profile,Italian Painter,Unavailable,Italian,Italy,Unavailable,European Paintings
436481,"Cafe House, Cairo (Casting Bullets)",Jean-Léon Gérôme,1884 or earlier,French,France,1800's,European Paintings
436482,Prayer in the Mosque,Jean-Léon Gérôme,1871,French,France,1800's,European Paintings
436483,Pygmalion and Galatea,Jean-Léon Gérôme,ca. 1890,French,France,1800's,European Paintings
436484,Tiger and Cubs,Jean-Léon Gérôme,ca. 1884,French,France,1800's,European Paintings
436489,Francesco Sassetti (1421–1490) and His Son Teodoro,Domenico Ghirlandaio (Domenico Bigordi),ca. 1488,Italian,Italy,1400's,European Paintings
436491,Selvaggia Sassetti (born 1470),Davide Ghirlandaio (David Bigordi),ca. 1487–88,Italian,Italy,1400's,European Paintings
436492,Saint Christopher and the Infant Christ,Domenico Ghirlandaio (Domenico Bigordi),Unavailable,Italian,Italy,Unavailable,European Paintings
436494,The Nativity with Saints,Ridolfo Ghirlandaio,Unavailable,Italian,Italy,Unavailable,European Paintings
436495,Saint John the Evangelist Raises Satheus to Life,Francescuccio Ghissi (Francesco di Cecco Ghissi),ca. 1370,Italian,Italy,1300's,European Paintings
436496,Saint John the Evangelist with Acteus and Eugenius,Francescuccio Ghissi (Francesco di Cecco Ghissi),ca. 1370,Italian,Italy,1300's,European Paintings
436497,Saint John the Evangelist Causes a Pagan Temple to Collapse,Francescuccio Ghissi (Francesco di Cecco Ghissi),ca. 1370,Italian,Italy,1300's,European Paintings
436499,Diana the Huntress,Giampietrino (Giovanni Pietro Rizzoli),Unavailable,Italian,Italy,Unavailable,European Paintings
436503,The Flight into Egypt,Luca Giordano,Unavailable,Italian,Italy,Unavailable,European Paintings
436510,Madonna and Child with Two Angels and a Donor,Giovanni di Paolo (Giovanni di Paolo di Grazia),ca. 1445,Italian,Italy,1400's,European Paintings
436511,The Miraculous Communion of Saint Catherine of Siena,Giovanni di Paolo (Giovanni di Paolo di Grazia),Unavailable,Italian,Italy,Unavailable,European Paintings
