objectID,Title,ArtistName,TimePeriod,Region Detailed,Country,Century,Culture,Height,Width,H/W Ratio,Color
437363,William Forsyth (1749–1814),Sir Henry Raeburn,ca. 1800,"British, Scottish",Britain,1800's,European Paintings,3213,3856,0.833246888,RGB
437364,William Scott-Elliot of Arkleton (1811–1901),Sir Henry Raeburn,ca. 1815–16,"British, Scottish",Britain,1800's,European Paintings,2999,3857,0.777547317,RGB
437365,"William Robertson (1753–1835), Lord Robertson",Sir Henry Raeburn,1805,"British, Scottish",Britain,1800's,European Paintings,3085,3854,0.800467047,RGB
437368,Holy Family with an Angel,Raffaellino del Garbo (also known as Raffaelle de' Capponi and Raffaelle de' Carli),ca. 1490,Italian,Italy,1400's,European Paintings,2788,4000,0.697,RGB
437371,The Agony in the Garden,Raphael (Raffaello Sanzio or Santi),ca. 1504,Italian,Italy,1500's,European Paintings,3851,3330,1.156456456,RGB
437373,"Giuliano de' Medici (1479–1516), Duke of Nemours",Raphael,Unavailable,unavailable,Unavailable,Unavailable,European Paintings,1502,1935,0.77622739,RGB
437376,A Cat Stealing Fish,Giuseppe Recco,late 1660s,Italian,Italy,1600's,European Paintings,4000,3143,1.272669424,RGB
437378,Bouquet in a Chinese Vase,Odilon Redon,ca. 1912–14,French,France,1900's,European Paintings,2983,3869,0.771000258,RGB
437380,The Chariot of Apollo,Odilon Redon,1905–16,French,France,1900's,European Paintings,1953,1574,1.240787802,RGB
437381,Etruscan Vase with Flowers,Odilon Redon,1900–1910,French,France,1900's,European Paintings,2740,3722,0.736163353,RGB
437382,Vase of Flowers (Pink Background),Odilon Redon,ca. 1906,French,France,1900's,European Paintings,2774,3722,0.745298227,RGB
437384,Salome,Henri Regnault,1870,French,France,1800's,European Paintings,1150,1840,0.625,RGB
437385,Man in a Turban,Rembrandt (Rembrandt van Rijn),1632,Dutch,Netherlands,1600's,European Paintings,3140,3857,0.814104226,RGB
437386,"Portrait of a Man, probably a Member of the Van Beresteyn Family",Rembrandt (Rembrandt van Rijn),1632,Dutch,Netherlands,1600's,European Paintings,3049,3824,0.797332636,RGB
437388,"Portrait of a Woman, probably a Member of the Van Beresteyn Family",Rembrandt (Rembrandt van Rijn),1632,Dutch,Netherlands,1600's,European Paintings,2964,3722,0.796346051,RGB
437389,Bellona,Rembrandt (Rembrandt van Rijn),1633,Dutch,Netherlands,1600's,European Paintings,2963,3861,0.767417767,RGB
437391,Portrait of a Young Woman with a Fan,Rembrandt (Rembrandt van Rijn),1633,Dutch,Netherlands,1600's,European Paintings,3206,4000,0.8015,RGB
437392,Herman Doomer (ca. 1595–1650),Rembrandt (Rembrandt van Rijn),1640,Dutch,Netherlands,1600's,European Paintings,2745,3722,0.737506717,RGB
437393,The Toilet of Bathsheba,Rembrandt (Rembrandt van Rijn),1643,Dutch,Netherlands,1600's,European Paintings,3810,2845,1.339191564,RGB
437394,Aristotle with a Bust of Homer,Rembrandt (Rembrandt van Rijn),1653,Dutch,Netherlands,1600's,European Paintings,3647,3839,0.949986976,RGB
437395,"The Standard Bearer (Floris Soop, 1604–1657)",Rembrandt (Rembrandt van Rijn),1654,Dutch,Netherlands,1600's,European Paintings,3135,3789,0.827395091,RGB
437396,Hendrickje Stoffels (1626–1663),Rembrandt (Rembrandt van Rijn),mid-1650s,Dutch,Netherlands,1600's,European Paintings,3263,3695,0.88308525,RGB
437398,Flora,Rembrandt (Rembrandt van Rijn),ca. 1654,Dutch,Netherlands,1600's,European Paintings,1748,1903,0.918549658,RGB
437399,Man with a Magnifying Glass,Rembrandt (Rembrandt van Rijn),early 1660s,Dutch,Netherlands,1600's,European Paintings,3028,3717,0.814635459,RGB
437401,Portrait of a Man Holding Gloves,Rembrandt (Rembrandt van Rijn),1648,Dutch,Netherlands,1600's,European Paintings,729,900,0.81,RGB
437402,Woman with a Pink,Rembrandt (Rembrandt van Rijn),early 1660s,Dutch,Netherlands,1600's,European Paintings,2989,3721,0.803278689,RGB
437403,Christ and the Woman of Samaria,Rembrandt,Unavailable,Dutch,Netherlands,Unavailable,European Paintings,2912,3722,0.782375067,RGB
437405,A Young Woman as a Shepherdess,Govert Flinck,Unavailable,Dutch,Netherlands,Unavailable,European Paintings,2833,3722,0.761149919,RGB
437406,"Portrait of a Man (""The Auctioneer"")",Rembrandt,probably ca. 1658–62,Dutch,Netherlands,1600's,European Paintings,2983,3722,0.801450833,RGB
437407,Christ with a Staff,Rembrandt,Unavailable,Dutch,Netherlands,Unavailable,European Paintings,3104,3710,0.836657682,RGB
437408,Man in a Beret,Rembrandt,Unavailable,Dutch,Netherlands,Unavailable,European Paintings,1493,1801,0.828983898,RGB
437410,Portrait of a Man with a Breastplate and Plumed Hat,Rembrandt,Unavailable,Dutch,Netherlands,Unavailable,European Paintings,3113,3850,0.808571429,RGB
437411,Man with a Steel Gorget,Rembrandt,Unavailable,Dutch,Netherlands,Unavailable,European Paintings,3166,3836,0.825338895,RGB
437412,Old Woman Cutting Her Nails,Rembrandt,ca. 1655–60,Dutch,Netherlands,1600's,European Paintings,3131,3856,0.811981328,RGB
437413,Man in a Red Cloak,Rembrandt,Unavailable,Dutch,Netherlands,Unavailable,European Paintings,3118,3709,0.840657859,RGB
437415,The Sibyl,Willem Drost,ca. 1654,Dutch,Netherlands,1600's,European Paintings,2941,3721,0.79037893,RGB
437416,Man in Armor (Mars?),Rembrandt,Unavailable,Dutch,Netherlands,Unavailable,European Paintings,3290,3692,0.891115926,RGB
437417,"Lieven Willemsz van Coppenol (born about 1599, died 1671 or later)",Rembrandt (Rembrandt van Rijn),Unavailable,Dutch,Netherlands,Unavailable,European Paintings,2951,3722,0.792853305,RGB
437418,Man with a Beard,Rembrandt,Unavailable,Dutch,Netherlands,Unavailable,European Paintings,3294,3757,0.876763375,RGB
437419,Rembrandt (1606–1669) as a Young Man,Rembrandt,Unavailable,Dutch,Netherlands,Unavailable,European Paintings,2791,3722,0.749865664,RGB
437420,Rembrandt's Son Titus (1641–1668),Rembrandt,Unavailable,Dutch,Netherlands,Unavailable,European Paintings,2897,3853,0.751881651,RGB
437421,Study Head of an Old Man,Rembrandt,Unavailable,Dutch,Netherlands,Unavailable,European Paintings,3095,3711,0.834007006,RGB
437423,The Immaculate Conception,Guido Reni,1627,Italian,Italy,1600's,European Paintings,2597,3722,0.697743149,RGB
437424,"Madame Édouard Bernier (Marie-Octavie-Stéphanie Laurens, 1838–1920)",Auguste Renoir,1871,French,France,1800's,European Paintings,3001,3719,0.806937349,RGB
437425,Marguerite-Thérèse (Margot) Berard (1874–1956),Auguste Renoir,1879,French,France,1800's,European Paintings,2924,3722,0.78559914,RGB
437426,View of the Seacoast near Wargemont in Normandy,Auguste Renoir,1880,French,France,1800's,European Paintings,3865,3167,1.220397853,RGB
437427,The Bay of Naples,Auguste Renoir,1881,French,France,1800's,European Paintings,3811,2775,1.373333333,RGB
437428,Still Life with Peaches and Grapes,Auguste Renoir,1881,French,France,1800's,European Paintings,4000,3353,1.192961527,RGB
437429,Still Life with Peaches,Auguste Renoir,1881,French,France,1800's,European Paintings,3803,3153,1.20615287,RGB
437430,By the Seashore,Auguste Renoir,1883,French,France,1800's,European Paintings,3162,4000,0.7905,RGB
437431,"Hills around the Bay of Moulin Huet, Guernsey",Auguste Renoir,1883,French,France,1800's,European Paintings,4000,2879,1.389371309,RGB
437432,"Tilla Durieux (Ottilie Godeffroy, 1880–1971)",Auguste Renoir,1914,French,France,1900's,European Paintings,2994,3720,0.80483871,RGB
437433,"The Farm at Les Collettes, Cagnes",Auguste Renoir,1908–14,French,France,1900's,European Paintings,4000,3359,1.190830604,RGB
437434,In the Meadow,Auguste Renoir,1888–92,French,France,1800's,European Paintings,3027,3717,0.814366425,RGB
437436,A Road in Louveciennes,Auguste Renoir,ca. 1870,French,France,1800's,European Paintings,1953,1599,1.221388368,RGB
437437,A Waitress at Duval's Restaurant,Auguste Renoir,ca. 1875,French,France,1800's,European Paintings,2679,3722,0.719774315,RGB
437438,Young Girl in a Pink-and-Black Hat,Auguste Renoir,ca. 1891,French,France,1800's,European Paintings,2933,3722,0.788017195,RGB
437439,A Young Girl with Daisies,Auguste Renoir,1889,French,France,1800's,European Paintings,3345,4000,0.83625,RGB
437443,"Thomas (1740–1825) and Martha Neate (1741–after 1795) with His Tutor, Thomas Needham",Sir Joshua Reynolds,1748,British,Britain,1700's,European Paintings,3601,3268,1.101897185,RGB
437444,"Anne Dashwood (1743–1830), Later Countess of Galloway",Sir Joshua Reynolds,1764,British,Britain,1700's,European Paintings,3456,3853,0.896963405,RGB
437445,"George Capel, Viscount Malden (1757–1839), and Lady Elizabeth Capel (1755–1834)",Sir Joshua Reynolds,1768,British,Britain,1700's,European Paintings,3083,3816,0.807914046,RGB
437446,"Mrs. Horton, Later Viscountess Maynard (died 1814/15)",Sir Joshua Reynolds,Unavailable,British,Britain,Unavailable,European Paintings,2999,3872,0.774535124,RGB
437447,Captain George K. H. Coussmaker (1759–1801),Sir Joshua Reynolds,1782,British,Britain,1700's,European Paintings,2394,3866,0.619244697,RGB
437448,"Georgiana Augusta Frederica Elliott (1782–1813), Later Lady Charles Bentinck",Sir Joshua Reynolds,1784,British,Britain,1700's,European Paintings,3214,3853,0.834155204,RGB
437449,The Honorable Henry Fane (1739–1802) with Inigo Jones and Charles Blair,Sir Joshua Reynolds,1761–66,British,Britain,1700's,European Paintings,3911,2785,1.404308797,RGB
437450,"Mrs. Lewis Thomas Watson (Mary Elizabeth Milles, 1767–1818)",Sir Joshua Reynolds,1789,British,Britain,1700's,European Paintings,3073,3847,0.798804263,RGB
437451,John Barker (1707–1787),Sir Joshua Reynolds,1786,British,Britain,1700's,European Paintings,2708,3876,0.698658411,RGB
437452,"Lady Smith (Charlotte Delaval) and Her Children (George Henry, Louisa, and Charlotte)",Sir Joshua Reynolds,1787,British,Britain,1700's,European Paintings,3077,3860,0.797150259,RGB
437454,"Mrs. George Baldwin (Jane Maltass, 1763–1839)",Sir Joshua Reynolds,1782 or later,British,Britain,1700's,European Paintings,1522,1931,0.788192646,RGB
437455,The Holy Family with Saints Anne and Catherine of Alexandria,Jusepe de Ribera (called Lo Spagnoletto),1648,Spanish,Spain,1600's,European Paintings,2763,3722,0.742342826,RGB
437456,Breton Fishermen and Their Families,Théodule-Augustin Ribot,possibly ca. 1880–85,French,France,1800's,European Paintings,3111,3710,0.838544474,RGB
437458,The Holy Family with Angels,Sebastiano Ricci,ca. 1700,Italian,Italy,1700's,European Paintings,3540,4000,0.885,RGB
437460,A Canal in Venice,Martín Rico y Ortega,1879,Spanish,Spain,1800's,European Paintings,1955,1472,1.328125,RGB
437461,On the Seine,Martín Rico y Ortega,1869,Spanish,Spain,1800's,European Paintings,1959,1187,1.650379107,RGB
437462,A Spanish Garden,Martín Rico y Ortega,1871,Spanish,Spain,1800's,European Paintings,1247,1936,0.64411157,RGB
437463,Portrait of a General Officer,Hyacinthe Rigaud,ca. 1710,French,France,1700's,European Paintings,3083,4000,0.77075,RGB
437464,Louis XV (1710–1774) as a Child,Hyacinthe Rigaud,ca. 1716–24,unavailable,Unavailable,1700's,European Paintings,2792,3882,0.719216899,RGB
437468,The Portico of a Country Mansion,Hubert Robert,1773,French,France,1700's,European Paintings,1167,1936,0.602789256,RGB
437471,Aqueduct in Ruins,Hubert Robert,Unavailable,French,France,Unavailable,European Paintings,1957,1162,1.684165232,RGB
437473,The Bathing Pool,Hubert Robert,Unavailable,French,France,Unavailable,European Paintings,1387,1934,0.717166494,RGB
437474,Bridge over a Cascade,Hubert Robert,Unavailable,French,France,Unavailable,European Paintings,1957,1160,1.687068966,RGB
437479,The Return of the Cattle,Hubert Robert,ca. 1773–75,French,France,1700's,European Paintings,1161,1936,0.599690083,RGB
437480,The Swing,Hubert Robert,Unavailable,French,France,Unavailable,European Paintings,1003,1932,0.519151139,RGB
437481,Wandering Minstrels,Hubert Robert,Unavailable,French,France,Unavailable,European Paintings,1375,1934,0.710961737,RGB
437487,"Francesco d'Este (born about 1429, died after July 20, 1486)",Rogier van der Weyden,ca. 1460,Netherlandish,Netherlands,1400's,European Paintings,1209,1743,0.69363167,RGB
437488,Portrait of a Man in a Chaperon,Netherlandish Painter,Unavailable,unavailable,Unavailable,Unavailable,European Paintings,2589,3721,0.695780704,RGB
437492,The Holy Family with Saint Paul and a Donor,Rogier van der Weyden,Unavailable,Netherlandish,Netherlands,Unavailable,European Paintings,3123,3708,0.84223301,RGB
437494,"Friedrich I (1460–1536), Margrave of Brandenburg-Ansbach",Franz Wolfgang Rohrich,Unavailable,German,Germany,Unavailable,European Paintings,2939,4000,0.73475,RGB
437495,Sophia (1464–1512) of Poland,Franz Wolfgang Rohrich,Unavailable,German,Germany,Unavailable,European Paintings,2970,4000,0.7425,RGB
437496,The Sacrifice of Polyxena,Giovanni Francesco Romanelli,Unavailable,Italian,Italy,Unavailable,European Paintings,3905,3448,1.132540603,RGB
437497,The Flagellation; (reverse) The Madonna of Mercy,Girolamo Romanino,ca. 1540,Italian,Italy,1500's,European Paintings,2607,3722,0.700429876,RGB
437498,"Portrait of a Woman, Said to Be Emily Bertie Pott (died 1782)",George Romney,1781,British,Britain,1700's,European Paintings,3247,3858,0.841627786,RGB
437500,"Lady Elizabeth Stanley (1753–1797), Countess of Derby",George Romney,1776–78,British,Britain,1700's,European Paintings,3100,3863,0.802485115,RGB
437501,"Mrs. Bryan Cooke (Frances Puleston, 1765–1818)",George Romney,ca. 1787–91,British,Britain,1700's,European Paintings,3031,3817,0.79407912,RGB
437502,"Mrs. Charles Frederick (Martha Rigden, died 1794)",George Romney,Unavailable,British,Britain,Unavailable,European Paintings,3205,3855,0.831387808,RGB
437503,"Mrs. George Horsley (Charlotte Mary Talbot, died 1828)",John Westbrooke Chandler,Unavailable,British,Britain,Unavailable,European Paintings,3202,3845,0.832769831,RGB
437505,Admiral Sir Chaloner Ogle (1726–1816),George Romney,Unavailable,British,Britain,Unavailable,European Paintings,3131,3793,0.825467967,RGB
437506,Bandits on a Rocky Coast,Salvator Rosa,1655–60,Italian,Italy,1600's,European Paintings,4000,3054,1.309757695,RGB
437507,The Dream of Aeneas,Salvator Rosa,1660–65,Italian,Italy,1600's,European Paintings,2388,3875,0.616258065,RGB
437512,The Banks of the Bièvre near Bicêtre,Henri Rousseau (le Douanier),ca. 1908–09,French,France,1900's,European Paintings,3110,3710,0.838274933,RGB
437513,Still Life with Ham,Philippe Rousseau,1870s,French,France,1800's,European Paintings,3809,3058,1.24558535,RGB
437514,"The Edge of the Woods at Monts-Girard, Fontainebleau Forest",Théodore Rousseau,1852–54,French,France,1800's,European Paintings,3809,2492,1.528491172,RGB
437515,A Meadow Bordered by Trees,Théodore Rousseau,ca. 1845,French,France,1800's,European Paintings,4000,2670,1.498127341,RGB
437516,An Old Chapel in a Valley,Théodore Rousseau,ca. 1835,French,France,1800's,European Paintings,4000,3077,1.299967501,RGB
437517,A Path among the Rocks,Théodore Rousseau,probably 1861,French,France,1800's,European Paintings,3811,2416,1.577400662,RGB
437518,A River in a Meadow,Théodore Rousseau,ca. 1840,French,France,1800's,European Paintings,4000,2639,1.515725654,RGB
437519,A River Landscape,Théodore Rousseau,Unavailable,French,France,Unavailable,European Paintings,1957,1300,1.505384615,RGB
437520,Sunset near Arbonne,Théodore Rousseau,ca. 1860–65,French,France,1800's,European Paintings,3811,2433,1.566378956,RGB
437523,Atalanta and Meleager,Peter Paul Rubens,ca. 1616,Flemish,Belgium,1600's,European Paintings,1535,1933,0.794102431,RGB
437525,The Feast of Acheloüs,Peter Paul Rubens,ca. 1615,Flemish,Belgium,1600's,European Paintings,3811,2530,1.506324111,RGB
437526,A Forest at Dawn with a Deer Hunt,Peter Paul Rubens,ca. 1635,Flemish,Belgium,1600's,European Paintings,3807,2624,1.450838415,RGB
437527,The Glorification of the Eucharist,Peter Paul Rubens,ca. 1630–32,Flemish,Belgium,1600's,European Paintings,2773,4000,0.69325,RGB
437528,The Holy Family with Saints Francis and Anne and the Infant Saint John the Baptist,Peter Paul Rubens,early or mid-1630s,Flemish,Belgium,1600's,European Paintings,4000,3409,1.173364623,RGB
437529,"The Holy Family with Saint Elizabeth, Saint John, and a Dove",Peter Paul Rubens,ca. 1608–9,Flemish,Belgium,1600's,European Paintings,1221,1567,0.779195916,RGB
437530,"Portrait of a Man, Possibly an Architect or Geographer",Peter Paul Rubens,1597,Flemish,Belgium,1500's,European Paintings,2485,3722,0.6676518,RGB
437531,"Portrait of a Woman, Probably Susanna Lunden (Susanna Fourment, 1599–1628)",Peter Paul Rubens,ca. 1625–27,Flemish,Belgium,1600's,European Paintings,3133,4000,0.78325,RGB
437532,"Rubens, Helena Fourment (1614–1673), and Their Son Frans (1633–1678)",Peter Paul Rubens,ca. 1635,Flemish,Belgium,1600's,European Paintings,3090,3973,0.777749811,RGB
437533,Study of Two Heads,Peter Paul Rubens,ca. 1609,Flemish,Belgium,1600's,European Paintings,2874,3819,0.752553024,RGB
437534,The Triumph of Henry IV,Peter Paul Rubens,ca. 1630,Flemish,Belgium,1600's,European Paintings,3811,2248,1.695284698,RGB
437535,Venus and Adonis,Peter Paul Rubens,probably mid-1630s,Flemish,Belgium,1600's,European Paintings,3809,3089,1.233085141,RGB
437536,Wolf and Fox Hunt,Peter Paul Rubens,ca. 1616,Flemish,Belgium,1600's,European Paintings,3811,2462,1.547928513,RGB
437539,Cambyses Appointing Otanes Judge,Peter Paul Rubens,Unavailable,Flemish,Belgium,Unavailable,European Paintings,2967,3003,0.988011988,RGB
437540,Frans Francken I (1542–1616),Peter Paul Rubens,Unavailable,Flemish,Belgium,Unavailable,European Paintings,1336,1758,0.759954494,RGB
437542,Saint Teresa of Ávila Interceding for Souls in Purgatory,Peter Paul Rubens,Unavailable,Flemish,Belgium,Unavailable,European Paintings,3094,4000,0.7735,RGB
437543,Susanna and the Elders,Peter Paul Rubens,Unavailable,Flemish,Belgium,Unavailable,European Paintings,3612,2664,1.355855856,RGB
437545,Landscape with a Village in the Distance,Jacob van Ruisdael,1646,Dutch,Netherlands,1600's,European Paintings,3811,2649,1.438656097,RGB
437546,The Forest Stream,Jacob van Ruisdael,ca. 1660,Dutch,Netherlands,1600's,European Paintings,3903,3020,1.292384106,RGB
437547,Grainfields,Jacob van Ruisdael,mid- or late 1660s,Dutch,Netherlands,1600's,European Paintings,3895,3233,1.204763378,RGB
437548,Mountain Torrent,Jacob van Ruisdael,1670s,Dutch,Netherlands,1600's,European Paintings,3118,4000,0.7795,RGB
437549,Wheat Fields,Jacob van Ruisdael,ca. 1670,Dutch,Netherlands,1600's,European Paintings,3811,2951,1.291426635,RGB
437552,The Protection of the Mother of God,Russian Painter,Unavailable,Russian,Russia,Unavailable,European Paintings,2683,3171,0.84610533,RGB
437555,The Congregation of the Mother of God,Russian Painter,Unavailable,Russian,Russia,Unavailable,European Paintings,2835,3259,0.869898742,RGB
437556,Saint Elias's Fiery Ascension,Russian Painter,Unavailable,Russian,Russia,Unavailable,European Paintings,3004,3332,0.901560624,RGB
437557,Panel from a Saints' Calendar (painted on both sides),Russian Painter,Unavailable,Russian,Russia,Unavailable,European Paintings,2531,2919,0.867077766,RGB
437558,Saint George,Russian Painter,Unavailable,Russian,Russia,Unavailable,European Paintings,518,700,0.74,RGB
437559,The Christ Child with Saints Boris and Gleb,Russian Painter,Unavailable,Russian,Russia,Unavailable,European Paintings,1276,1360,0.938235294,RGB
437560,Saints Boris and Gleb,Russian Painter,Unavailable,Russian,Russia,Unavailable,European Paintings,2707,3155,0.85800317,RGB
437564,The Resurrection of Christ and the Harrowing of Hell,Russian Painter,Unavailable,Russian,Russia,Unavailable,European Paintings,2755,3419,0.805791167,RGB
437566,Christ's Entry into Jerusalem,Russian Painter,Unavailable,Russian,Russia,Unavailable,European Paintings,2675,3227,0.828943291,RGB
437568,Three Female Saints,Russian Painter,Unavailable,Russian,Russia,Unavailable,European Paintings,2627,3195,0.822222222,RGB
437578,Christ in Glory,Russian (Novgorod?) Painter,Unavailable,Russian,Russia,Unavailable,European Paintings,2624,3722,0.704997313,RGB
437585,Market by the Seashore,Salomon van Ruysdael,1637,Dutch,Netherlands,1600's,European Paintings,3811,2426,1.570898599,RGB
437586,A Country Road,Salomon van Ruysdael,1648,Dutch,Netherlands,1600's,European Paintings,3811,2815,1.353818828,RGB
437587,Marine,Salomon van Ruysdael,1650,Dutch,Netherlands,1600's,European Paintings,3810,3016,1.263262599,RGB
437588,Drawing the Eel,Salomon van Ruysdael,early 1650s,Dutch,Netherlands,1600's,European Paintings,3885,2763,1.406080347,RGB
437589,Ferry near Gorinchem,Salomon van Ruysdael,1646,Dutch,Netherlands,1600's,European Paintings,3901,3102,1.257575758,RGB
437590,View of the Town of Alkmaar,Salomon van Ruysdael,Unavailable,Dutch,Netherlands,Unavailable,European Paintings,3811,2403,1.585934249,RGB
437591,Rustic Interior,David Ryckaert III,Unavailable,Flemish,Belgium,Unavailable,European Paintings,4000,3211,1.245717845,RGB
437592,The Yard of the Inn at Emmaus,David Ryckaert III,Unavailable,Flemish,Belgium,Unavailable,European Paintings,4000,3170,1.261829653,RGB
437593,Marcantonio Pasqualini (1614–1691) Crowned by Apollo,Andrea Sacchi,1641,Italian,Italy,1600's,European Paintings,2978,3722,0.800107469,RGB
437606,The Massacre of the Innocents,Sano di Pietro (Ansano di Pietro di Mencio),ca. 1470,Italian,Italy,1400's,European Paintings,1611,1077,1.495821727,RGB
437608,Head of the Madonna,Franciabigio (Francesco di Cristofano),ca. 1509,Italian,Italy,1500's,European Paintings,3121,4000,0.78025,RGB
437609,The Holy Family with the Young Saint John the Baptist,Andrea del Sarto (Andrea d'Agnolo),ca. 1528,Italian,Italy,1500's,European Paintings,2875,3872,0.742510331,RGB
437611,The Journey of the Magi,Sassetta (Stefano di Giovanni),ca. 1433–35,Italian,Italy,1400's,European Paintings,3811,2864,1.330656425,RGB
437630,Saint Matthew and the Angel,Giovanni Gerolamo Savoldo,Unavailable,Italian,Italy,Unavailable,European Paintings,4000,2926,1.367053999,RGB
437631,Night Scene on the Volga,Alexei Kondratievich Savrasov,1871,Russian,Russia,1800's,European Paintings,3619,2171,1.666973745,RGB
437633,Cephalus and Procris,Godfried Schalcken,probably 1680s,Dutch,Netherlands,1600's,European Paintings,4000,3199,1.250390747,RGB
437636,Domestic Scene,German Painter,Unavailable,German,Germany,Unavailable,European Paintings,3047,3716,0.819967707,RGB
437637,Lost: Souvenir of Auvergne,August Friedrich Albrecht Schenck,Unavailable,Danish,Denmark,Unavailable,European Paintings,3603,2171,1.659603869,RGB
437638,The Marriage of Cupid and Psyche,Andrea Schiavone (Andrea Meldola),ca. 1540,Italian,Italy,1500's,European Paintings,3805,3140,1.211783439,RGB
437639,Christ before Pilate; The Resurrection,Ludwig Schongauer,Unavailable,German,Germany,Unavailable,European Paintings,2096,3812,0.549842602,RGB
437640,Baron Alexander von Humboldt (1769–1859),Julius Schrader,1859,German,Germany,1800's,European Paintings,3440,3952,0.870445344,RGB
437641,Arabs on the March,Adolf Schreyer,Unavailable,German,Germany,Unavailable,European Paintings,4000,2480,1.612903226,RGB
437642,Battle Scene: Arabs Making a Detour,Adolf Schreyer,Unavailable,German,Germany,Unavailable,European Paintings,3681,2221,1.657361549,RGB
437643,The Building of Westminster Bridge,Samuel Scott,Unavailable,British,Britain,Unavailable,European Paintings,3913,2148,1.8216946,RGB
437645,"Portrait of a Man, Said to be Christopher Columbus (born about 1446, died 1506)",Sebastiano del Piombo (Sebastiano Luciani),1519,Italian,Italy,1500's,European Paintings,3332,4000,0.833,RGB
437646,Madonna and Child with Saints and Donors,Sebastiano del Piombo,Unavailable,Italian,Italy,Unavailable,European Paintings,3811,2534,1.50394633,RGB
437647,Spring in Brittany,Paul Sébillot,1874,French,France,1800's,European Paintings,3123,4000,0.78075,RGB
437648,Sir James Dashwood (1715–1779),Enoch Seeman the Younger,1737,German,Germany,1700's,European Paintings,2408,3806,0.632685234,RGB
437649,Christ Blessing,Segna di Buonaventura,ca. 1311,Italian,Italy,1300's,European Paintings,2438,3887,0.627218935,RGB
437652,The Virgin Adoring the Child with the Infant Saint John the Baptist,Jacopo di Arcangelo (called Jacopo del Sellaio),late 1480s,Italian,Italy,1400's,European Paintings,2364,3622,0.652678078,RGB
437654,Circus Sideshow (Parade de cirque),Georges Seurat,1887–88,French,France,1800's,European Paintings,3920,2621,1.495612362,RGB
437655,The Forest at Pontaubert,Georges Seurat,1881,French,France,1800's,European Paintings,2972,3722,0.798495433,RGB
437656,The Gardener,Georges Seurat,1882–83,French,France,1800's,European Paintings,3811,2419,1.575444399,RGB
437657,Landscape at Saint-Ouen,Georges Seurat,1878 or 1879,French,France,1800's,European Paintings,4000,2721,1.470047777,RGB
437658,"Study for ""A Sunday on La Grande Jatte""",Georges Seurat,1884,French,France,1800's,European Paintings,1959,1332,1.470720721,RGB
437659,View of the Seine,Georges Seurat,1882–83,French,France,1800's,European Paintings,4000,2706,1.4781966,RGB
437660,Portrait of a Horseman,James Seymour,Unavailable,British,Britain,Unavailable,European Paintings,3915,2798,1.399213724,RGB
437662,"William Archer Shee (1810–1899), the Artist's Son",Sir Martin Archer Shee,ca. 1820,Irish,Ireland,1800's,European Paintings,3220,3860,0.834196891,RGB
437673,The Assumption of the Virgin with Saints Michael and Benedict,Luca Signorelli,ca. 1493–96,Italian,Italy,1400's,European Paintings,2947,3820,0.771465969,RGB
437677,Saint Bartholomew,Simone Martini,ca. 1317–19,Italian,Italy,1300's,European Paintings,2880,3840,0.75,RGB
437678,Saint Matthias,Simone Martini,ca. 1317–19,Italian,Italy,1300's,European Paintings,2881,3864,0.745600414,RGB
437679,Saint Thomas,Simone Martini,ca. 1317–19,Italian,Italy,1300's,European Paintings,2896,3864,0.749482402,RGB
437680,The Bridge at Villeneuve-la-Garenne,Alfred Sisley,1872,British,Britain,1800's,European Paintings,4000,3000,1.333333333,RGB
